,title,datetime
415,Bindi Irwin Reveals Baby's Sex in Gender Reveal Photo,2020-09-22
416,China Eyes ‘New Battlefield’ In Looming Showdown Over U.S. Dollar Dominance,2020-09-22
417,Check out this custom GALAX GeForce RTX 3090 GAMER inspired by LEGO,2020-09-22
418,Tesla Battery Day Event News and Meeting Notes,2020-09-22
419,Carvana Sees Record Results for Several Earnings Categories,2020-09-22
420,Gwyneth Paltrow Celebrates Her 48th Birthday Completely Nude,2020-09-27
421,This Apple Supplier Deserves to Be on Your Watchlist,2020-09-27
422,"Novogratz: Dangerous Time to Be in Stocks, Bitcoin Has More ...",2020-09-27
423,Grayscale Investments Scooped Up Over 17000 BTC in the ...,2020-09-27
424,Crypto-Fueled Market Openbazaar to Close Shop Unless OB1 ...,2020-09-27
425,Pura delivers eco-friendly nappies after plastic-free wipes success,2020-09-27
426,Deepika Padukone asked not to play ’emotional card’ as she cried thrice during NCB Interrogation: Report,2020-09-27
427,"Days after announcement, UP Addl Chief Secy inspects proposed land for film city",2020-09-27
428,AAP sees ‘scam’ in Covid kits procurement in UP but ‘ignores’ inflated prices in Delhi; Is it just political posturing?,2020-09-27
429,'Big Brother All-Stars': Kevin Campbell on Who He Thinks Are the Fakest Houseguests (Exclusive),2020-10-02
430,Lisa Marie Presley's Son Benjamin Keough Laid to Rest With Elvis at Graceland,2020-10-02
431,Bitcoin Cash Price Path of Least Resistance is Lower - Chart,2020-10-02
432,Hathras case audio leak: TV journalist heard badgering victim’s brother to record a video,2020-10-02
433,Uber Freight Receives $500M From Greenbriar Investment,2020-10-02
434,Jessica Alba shares shocking experience with ‘Beverly Hills 90210’ cast,2020-10-02
435,Bitmex Charged With US Rules Violations — Owners Face ...,2020-10-02
436,Everything a Linux admin needs to know about working from the command line,2020-10-02
437,"Hathras horror: UP CM orders suspension of SP, DSP and few other policemen",2020-10-02
438,SPAQ Is an Interesting Play in a Red-Hot EV Market,2020-10-02
439,The 3 lesser known cryptocurrency that are worth looking into,2020-10-07
440,Meet The Biggest DEX Disrupter Backed By Binance And ...,2020-10-07
441,Tarek El Moussa and Heather Rae Young Talk Wedding Plans With No Exes Allowed (Exclusive),2020-10-07
442,Laura Osnes and Aaron Tveit Sing a Christmas Classic in Hallmark's 'One Royal Holiday' First Look (Exclusive),2020-10-07
443,'RHOC': Shannon Beador on Ending Her Friendship With Tamra Judge and Vicki Gunvalson and Season 15 (Exclusive),2020-10-07
444,P2P Exchange Paxful Supports Lira-Baked Stablecoin BiLira (TRYB),2020-10-07
445,5 Blue-chip Stocks to Buy on a Discount to Fortify Portfolios,2020-10-07
446,Eli Lilly Files Emergency Use Application With FDA for COVID Antibody Treatment; Shares Leap,2020-10-07
447,China's Digital Currency Has Been Used in 3 Million ...,2020-10-07
448,Ex-JP Morgan investment banker gives 5 reasons why DeFi is reaching “escape velocity”,2020-10-07
449,"Kevin Hart Teases Upcoming ‘Trains, Planes and Automobile’ Remake With Will Smith (Exclusive)",2020-10-12
450,'Fleetwood Mac' Skateboarder Reacts to Mick Fleetwood's ...,2020-10-12
451,Matthew McConaughey Reunites With Cast of 'Dazed and Confused' for Virtual Table Read,2020-10-12
452,Flytrex pilot program with Walmart focusing on backyard drone deliveries,2020-10-12
453,Spirit Airlines Is The Best Of A Bad Bunch of Airline Stocks,2020-10-12
454,Revolut Applies for Charter Banking License in the US,2020-10-12
455,"Binance Coin, Litecoin & Chainlink - American Wrap: 10/12/2020",2020-10-12
456,Argentex Revenue Slumped by 14.7% in H1 2021 Fiscal,2020-10-12
457,Crypto Cruise Ship 'Satoshi' to Make Panama Bay Home ...,2020-10-12
458,Pepsi Target at Wall Street High on Expected Wider Margins,2020-10-12
459,Bitcoin Takes One Step Closer to a More Scalable and Private ...,2020-10-17
460,Bitcoin's Creator vs. Bezos: Satoshi Nakamoto's Uphill Climb ...,2020-10-17
461,10 Reasons Bitcoin Is a Terrible Investment,2020-10-17
462,"Bulandshahr by-polls: At SP-RLD joint rally, Ajit Singh tears into BJP",2020-10-17
463,"In 2019-2020, Congress Introduced 40 Crypto And Blockchain Bills",2020-10-17
464,"UP’s Balrampur sees inauguration of 16 projects in a day, Rs 500 crore fund alloted for expediting projects",2020-10-17
465,"‘Pink Patrol’ launched in Lucknow: 100 two-wheelers, 10 four-wheelers to safeguard women in city",2020-10-17
466,"On 1st day of Navratri, ‘Mission Shakti’ campaign begins in UP to stop crime against women",2020-10-17
467,“Free” Bitcoin: Hungarian Politician Caught Stealing Electricity to Mine,2020-10-17
468,Anthony Mackie Talks Filming 'The Falcon and the Winter Soldier' in 'Quarantine' (Exclusive),2020-10-22
469,Forrester: AI and automation will help organizations rethink the future of work,2020-10-22
470,ALGN Stock: Align Technologies Stock Soars 30% on Q3 Sales,2020-10-22
471,'Hannah Montana' Alum Jason Earles Has the Best of Both Worlds in Disney Series: First Look (Exclusive),2020-10-22
472,What will it take for Beijing to meet its climate goals? Changing how it governs entirely,2020-10-22
473,"Bitcoin, Ripple, & Chainlink - American Wrap: 10/22/2020",2020-10-22
474,'The Right Stuff': Jake McDorman on Alan Shepard's Biggest Torment (Exclusive),2020-10-22
475,"Juno Markets Adds Share CFDs, Taps Nasdaq for Market Data",2020-10-22
476,HSBC to Shed up to 300 Staff from the UK Offices,2020-10-22
477,Akon’s social ecosystem cryptocurrency ‘Akoin’ will begin trading on Bittrex Global on November 11,2020-10-22
478,Chrissy Teigen Pens Emotional Essay About Her Pregnancy Loss,2020-10-27
479,NXIVM Founder Keith Raniere Sentenced to 120 Years in Prison,2020-10-27
480,DBS Bank Is Planning to Launch a Digital Asset Exchange - CoinDesk,2020-10-27
481,Sharon Osbourne Talks Major Crush on Keanu Reeves and How Ozzy Feels About It (Exclusive),2020-10-27
482,Harley-Davidson Roars Past Wall Street's Earnings Forecast,2020-10-27
483,'COVID effect' will be a 'transformational moment on Madison Avenue forever': Brand guru Gary Vaynerchuk,2020-10-27
484,"Contactless payments and e-commerce got a big boost from the pandemic, says Visa’s Europe CEO",2020-10-27
485,Exact Sciences Surges on $2.5 Billion Deal to Buy Thrive,2020-10-27
486,Blockchain Startup's Plan To Upend Spotify: A $9.6M Cryptocurrency Giveaway,2020-10-27
487,Can Investors Bank on General Electric Ahead of Earnings?,2020-10-27
488,Sean Connery's Wife Reveals the Star Struggled With Dementia Before His Death,2020-11-01
489,"Nikki McKibbin, Finalist on 'American Idol' Season 1, Dead at 42",2020-11-01
490,Inside a 23-year-old YouTuber's $5150/month NYC apartment,2020-11-01
491,"Pewdiepie Joins the Blockchain AR Game Wallem, Players ...",2020-11-01
492,"Molestation case in UP: Congress district president beaten by women, video goes viral",2020-11-01
493,"Major success for security forces, Hizbul Muhajideen chief commander Saifullah killed in encounter",2020-11-01
494,Square Funds Project To Make Cryptocurrency Wallets More Accessible To Everyone,2020-11-01
495,‘Everspace 2’ delays Early Access due to ‘Cyberpunk 2077’,2020-11-01
496,Technician Used Airport’s Computers to Mine Ethereum in Italy: Report,2020-11-01
497,"Meet ‘The Padman’ of UP police: Inspired by PM Modi, DIG sets up unit for sanitary napkins",2020-11-01
498,"Al Roker Is Diagnosed With Prostate Cancer, Will Undergo Surgery",2020-11-06
499,Clare Crawley Reveals She Talks About Babies 'All the Time' Following Engagement to Dale Moss,2020-11-06
500,Stephen Colbert Gets Visibly Emotional Over President Trump's Speech: 'I Didn't Expect This to Break My Heart',2020-11-06
501,Gleb Savchenko Splits From Wife Elena Samodanova After 14 Years of Marriage,2020-11-06
502,Divided government would be good for business,2020-11-06
503,"US election: Bitcoin to surge to $400,000 if Biden wins, expert claims",2020-11-06
504,Trump chief of staff Mark Meadows tests positive for COVID-19,2020-11-06
505,"Standard Chartered Names Michael Spiegel as Global Head, Transaction Banking",2020-11-06
506,"Insurer AIG sees operating profit up, net income down in third ...",2020-11-06
507,This Swiss bank is now staking Tezos (XTZ) for its clients,2020-11-06
508,Lady A Drops From CMA Awards After Family Member Tests Positive for COVID-19,2020-11-11
509,Lee Brice Celebrates Early CMA Awards Win While in Quarantine for COVID-19,2020-11-11
510,"Bitcoin Holds, Ethereum Surges As Biden Appoints Cryptocurrency-Savvy Gary Gensler To Lead Financial Policy Transition Team",2020-11-11
511,'Grey's Anatomy': Jake Borelli Teases 'Wild' Season 17 and Scene That Elicited a 'Huge Gasp' (Exclusive),2020-11-11
512,'RHOSLC's Whitney Rose on Troublemaking Co-Stars and Being Excommunicated From the Mormon Church (Exclusive),2020-11-11
513,LegacyFX Launches PAMM Accounts,2020-11-11
514,This Yearn.finance (YFI) competitor surged 60% in the past day alone,2020-11-11
515,Disney Earnings Preview: What the Charts Say,2020-11-11
516,Chipotle Mexican Grill Will Launch First Digital-Only Restaurant,2020-11-11
517,Jim Cramer's Action Alerts PLUS Members-Only Call - Live at 11:30 a.m. ET,2020-11-11
518,Jane Seymour Reflects on $9 Million Debt and Love Affairs During 'Dr. Quinn' (Exclusive),2020-11-16
519,The risk of ‘faux flexibility’ in the post-COVID workplace,2020-11-16
520,'90 Day Fiancé': Jenny Has a Breakdown Over Her and Sumit's Age Difference,2020-11-16
521,Meet Fresh Updates in FBS Trader App,2020-11-16
522,Retail Is Coming: Game of Thrones star asks Twitter if she should long Bitcoin,2020-11-16
523,How Air Force 1s became Nike's best-selling sneaker,2020-11-16
524,Hedge fund mogul Chris Rokos takes Deloitte to court over ...,2020-11-16
525,"Bitcoin, Yearn.Finance & Ripple - American Wrap: 11/16/2020",2020-11-16
526,KPMG faces tribunal for misleading pension regulators in deal ...,2020-11-16
527,Hacked Platform Value DeFi Offers 1 Million DAI for Return of Funds,2020-11-16
528,"2017-era altcoins IOTA, XRP and more surge 25% amid crypto bull run",2020-11-21
529,Silk Road Bitcoin Seizure: Analytics Firm Claims Tokens ...,2020-11-21
530,"Bitcoin price could rocket to '$1,000,000' as big institutions buy directly from miners",2020-11-21
531,XRP Rises More Than 30% as Altcoins Piggyback on Bitcoin's Wave - CoinDesk,2020-11-21
532,Market Update: Crypto Asset Prices Spike Massively ...,2020-11-21
533,Is Bitcoin About To Become A $1 Trillion Asset?,2020-11-21
534,"West Bengal: Arjun Singh claims 5 TMC MPs ‘set to join BJP’, Sougata Roy rubbishes report",2020-11-21
535,Crypto Assets in South Africa Would Be Considered Financial Products Under Regulator Proposal - CoinDesk,2020-11-21
536,Ex-Bigg Boss fame Sana Khan marries Mufti Anas in Gujarat (VIDEO),2020-11-21
537,Drugs Case: NCB detains comedian Bharti Singh and her husband after raiding their Mumbai residence,2020-11-21
538,Renowned Finance Youtuber Andrei Jikh Invests Over $100K ...,2020-11-26
539,Alexander Höptner Parts Ways with Boerse Stuttgart,2020-11-26
540,Oxford Competes with Cambridge to Win Algorithmic Crypto Trading Contest,2020-11-26
541,"Rajasthan: Harassed by husband, woman sets herself on fire, in-laws make video",2020-11-26
542,New exercise recommendations by WHO to stay healthy ...,2020-11-26
543,"Microsoft Spills Previews of Future Releases; Updates on Windows 10X, Android Apps Accessibility Included",2020-11-26
544,Spending Sats: A Look at This Year's Bitcoin Black Friday ...,2020-11-26
545,India can never forget wounds of 26/11 Mumbai terror attack: PM Modi,2020-11-26
546,"PM Modi calls for ‘One Nation, One Election’, says this is the need of India",2020-11-26
547,"Neetu Singh features on cover page of Women Entrepreneur, shares her journey of reaching industry pinnacle",2020-11-26
548,Postmates reveals Patrick Mahomes’ favorite food deliveries,2020-12-01
549,"Police seize $4 billion, US worried about China’s crypto lead: Blockheads",2020-12-01
550,Joe Manganiello on What Sofia Vergara Thinks of His Mohawk (Exclusive),2020-12-01
551,Elliot Page Will Continue Role on Netflix's ‘Umbrella Academy',2020-12-01
552,Trading veteran Peter Brandt argues that Bitcoin price is ...,2020-12-01
553,Polish KNF Seeks Traders’ Feedback on 100:1 Leverage,2020-12-01
554,"Ethereum 2.0 Goes Live with Beacon Chain as Community Staked 900,000 ETH",2020-12-01
555,"Ripple, Chainlink & Zilliqa - American Wrap: 12/1/2020",2020-12-01
556,A Non-Chinese Company Emerges as a Clear 5G Stock Winner,2020-12-01
557,South Korea Tax on Crypto Gains Delayed Until 2022,2020-12-01
558,Shark Tank's Kevin O'Leary Ready to Put 5% of His Portfolio in ...,2020-12-06
559,"Bitcoin surge: Traditional currency economies facing 'cardiac arrest', claims expert",2020-12-06
560,Robinhood Investors Are Missing Out on This Huge Cannabis Opportunity,2020-12-06
561,China Airdrops Digital Yuan Worth $3 Million — 10000 Stores ...,2020-12-06
562,"Bharat Bandh on 8 Dec: Congress, TRS, AAP, left parties extend support",2020-12-06
563,UPA govt supported reforms in APMC; then Agri Minister wrote to CMs for private sector participation,2020-12-06
564,Steve Wozniak launches blockchain-based energy company | Cryptopolitan,2020-12-06
565,Trump campaigned for Loeffler and Perdue — and himself — on Saturday night in Georgia,2020-12-06
566,Fractal Analytics looks to answer vaccine concerns with data modelling,2020-12-06
567,Are Bitcoin And Other Cryptocurrencies Taxed In The UK?,2020-12-11
568,Stephen Colbert Flirts With Wife Evie in Cute 'Role Playing' Sketch,2020-12-11
569,There Is Light at the End of the Tunnel for Lyft,2020-12-11
570,Meet the Teenage Ukrainian Lawmaker With Millions in Monero - CoinDesk,2020-12-11
571,"Remo D’Souza suffers heart attack, admitted to Mumbai hospital",2020-12-11
572,7 Hot Stocks to Buy for the Holidays,2020-12-11
573,"Bitcoin Whales Buy Low, Sell High; Retail Investors Chase Rallies: Data - CoinDesk",2020-12-11
574,Long-delayed 'Super Meat Boy Forever' arrives on PC December 23rd,2020-12-11
575,Morning Bell With Jim Cramer: Tesla Can Go Higher,2020-12-11
576,"Revolut App Adds 4 Cryptos to Buying, Selling Service",2020-12-11
577,"Above $20,000: Bitcoin Trading To An All Time High",2020-12-16
578,"Bitcoin, THETA & Ripple - American Wrap: 12/16/2020",2020-12-16
579,Bitcoin price rockets past $20K to new all-time highs,2020-12-16
580,"Tilray, FuboTV, American Outdoor: 5 Top Stock Gainers Wednesday",2020-12-16
581,Cryptocurrency Investors in US and Japan Reaches New High,2020-12-16
582,How to ensure that your payment processes are smart and secure,2020-12-16
583,DISH Network Falls on $2 Billion Convertible Bond Offering,2020-12-16
584,"Fed Keeps Rates On Hold, Vows Near-Zero Fed Funds Through 2023",2020-12-16
585,"Fintech Spotlight: How tZero Is Narrowing The Delta Between Public, Private Assets",2020-12-16
586,Bitcoin goes to the moon!,2020-12-16
587,"Elon Musk trolls Bitcoin, causes novelty Dogecoin to soar",2020-12-21
588,"Elon Musk calls Bitcoin 'bs,' sends rival Dogecoin up 20 percent",2020-12-21
589,Elon Musk's Dogecoin endorsement triggers short-lived pump ...,2020-12-21
590,Banker's wife who spent £16m at Harrods loses Supreme ...,2020-12-21
591,Tradefeedr Announces $3 Million Funding as IPGL Becomes Cornerstone Investor,2020-12-21
592,"BP: Still British, Still Petroleum, Despite Its Attempt At Reinvention",2020-12-21
593,Jennifer Garner Sends 'Huge Love' to 'Juno' Co-Star Elliot Page,2020-12-21
594,"XRP, IOTA, Dogecoin Price Analysis: 21 December",2020-12-21
595,Got $600? Here Are 3 Hot Stocks to Buy Before 2021,2020-12-21
596,"Top 3 Price Prediction Bitcoin, Ethereum, Ripple: Bitcoin ...",2020-12-21
597,"Bitcoin Crosses $25,700, Aims At $26,000",2020-12-26
598,Biden Administration May Roll Back Some Crypto Regulations ...,2020-12-26
599,"Litecoin, Dogecoin, STEEM Price Analysis: 26 December",2020-12-26
600,'Unprecedented' Institutional Demand for Bitcoin: Bitgo's ...,2020-12-26
601,Rajasthan milkman’s daughter clears Judicial Services exam; qualifies to become judge,2020-12-26
602,Anti-farm laws protesters run tractor over police barricade in Uttarakhand,2020-12-26
603,Zero to $318000: Proponents and Detractors Give a Variety of ...,2020-12-26
604,Fake News! COVID-19 vaccine won't turn you into a zombie,2020-12-26
605,FIFA 21 Review: Improved Physics From Before Make it Enjoyable,2020-12-26
606,Jed McCaleb Believed to Have Paused Dumping XRP Over Ripple,2020-12-26
607,Coinbase Woes Continue with New Class Action Suit and ...,2020-12-31
608,"Darknet Giant White House Market Drops Bitcoin, Supports ...",2020-12-31
609,The biggest winner of Bitcoin's rally? Dogecoin. DOGE price soars 105% in one week,2021-01-05
610,Dogecoin up by 120%. What’s in store for traders?,2021-01-05
611,6 Altcoins Worth Shorting or Longing Today • CryptoMode ...,2021-01-05
612,"DOGE, DOT, ADA Price Surge Massively, Altcoin Season 2021 at the Doorstep!",2021-01-05
613,2021 Crypto Preview: Here's What's Coming Next,2021-01-05
614,Cryptocurrency Experts Make Their Predictions For 2021,2021-01-05
615,Here's the Popular Robinhood Stock Most Likely to Soar in 2021,2021-01-05
616,Mining Express é suspeita de pirâmide financeira,2021-01-05
617,Elon Musk simple tweet helps boost two unrelated' Signal ...,2021-01-10
618,Bitcoin Analyst Thomas Lee from Fundstrat Predicts that BTC Price Could Correct 50% from Current Levels Before Rising 300% in 2021,2021-01-10
619,Crypto Advocates Think Joe Biden's $3 Trillion Stimulus Plan ...,2021-01-10
620,wNews: Why the World's Richest Man Loves Dogecoin,2021-01-15
621,JPMorgan Had a Good Bad Year,2021-01-15
622,TLRY Stock: Why Tilray Shares Are Smoking Today,2021-01-15
623,"GAIL announces Rs 1,046.35 cr share buyback",2021-01-15
624,"Ethereum Price Moves up to $1,200 as Demand Threatens to Outstrip Supply on Exchanges",2021-01-15
625,Crypto Exchange Owner Sentenced to 10 Years in Prison for ...,2021-01-15
626,Dogecoin Price Analysis - DOGE Bulls Are Back On the Offensive As They Attempt Breakout Of Symmetrical Triangle,2021-01-15
627,MCA issues Clarification on Holding of AGM through Video Conferencing or Other Audio Visual mean,2021-01-15
628,CGST Delhi arrests Chartered Accountant for fraudulently passing on fake ITC of Rs 14.30 cr,2021-01-15
629,"Man offers local government $71 million to help him find drive containing 7,500 Bitcoin",2021-01-15
630,Pornhub Now Accepts Dogecoin Payments,2021-01-20
631,"Pornhub Now Accepts Cryptocurrencies XRP, DOGE, BNB and USDC",2021-01-20
632,Letter: The critics are wrong. Ruth Watkins has been a great president,2021-01-20
633,Rapper Soulja Boy Endorses Dogecoin; Explores Creating ...,2021-01-20
634,Bitcoin values poised to 'drop' as Joe Biden presidency to create 'volatile market',2021-01-20
635,4-Hour Work Week Author Tim Ferriss Shares His Thoughts About Bitcoin,2021-01-20
636,The Warning Sign That Correctly Called The Last Bitcoin Crash Is Back,2021-01-20
637,Bithumb CEO Predicts Only Four to Seven South Korean ...,2021-01-20
638,BlackBerry Continues Sharp Run Higher After Facebook Settlement,2021-01-20
639,"RAMP, Injective, & TomoChain Enter into a 3-Way Partnership ...",2021-01-20
640,"Soulja Boy Buys Bitcoin, Tries To Buy XRP, Reveals Altcoin Holdings to 5 Million Followers",2021-01-25
641,Why Designer Brands Is Soaring 32% Today,2021-01-25
642,The GameStop Game Never Stops,2021-01-25
643,"Litecoin, Crypto.com Coin, Dogecoin Price Analysis: 25 January",2021-01-25
644,"Kumbh Mela: Centre issues SOPs, makes COVID-19 negative report mandatory",2021-01-25
645,"Bank of Singapore Says Cryptocurrencies ""Could Replace ...",2021-01-25
646,Financials How Robinhood Crypto Makes Money Without ...,2021-01-25
647,28% GST on metal nuts as it is a part of motor vehicle: AAAR,2021-01-25
648,"Triterras, Inc. Announces Independent Investigation by the Audit Committee to Address and Rebut Recent Short Report",2021-01-25
649,"Sharia-compliant exchange, CoinMENA prepares for launch ...",2021-01-25
650,Dogecoin Tailspin: Price Drops Over 70% Following Reddit-Driven Surge,2021-01-30
651,Why Buying Dogecoin on Robinhood is Extremely Hard Right Now,2021-01-30
652,Dogecoin crashes as Reddit-fuelled cryptocurrency 'joke' falls flat,2021-01-30
653,Will Dogecoin survive the ongoing bearish infiltration? - Morning Tick,2021-01-30
654,"Dogecoin trading volume hits $5B, surpassing Bitcoin's for the ...",2021-01-30
655,"Dogecoin Price Takes Sharp Rise, Surprises Wall Street |",2021-01-30
656,"Dogecoin Plunges After Rally, Sparking Outcry on Reddit",2021-01-30
657,"Traders, influencers lick their wounds after vicious Dogecoin dump",2021-01-30
658,"What you need to know about GameStop, Dogecoin, short selling and short squeezing",2021-01-30
659,Pornhub Now Accepting Dogecoin After Card Payment Ban,2021-01-30
660,"Meet Dogecoin, the meme-inspired currency now worth billions",2021-02-04
661,"Dogecoin goes up over 40% after Elon Musk, Mark Cuban tweet about it",2021-02-04
662,What is dogecoin? Elon Musk has sent the meme cryptocurrency soaring,2021-02-04
663,Elon Musk tuitea y el Dogecoin crece alocadamente,2021-02-04
664,Ebang International Stock Rises Sharply After Litecoin and Dogecoin Announcement,2021-02-04
665,Ebang International Completes Chip Designing for Simultaneous Litecoin and Dogecoin Mining,2021-02-04
666,Elon Musk tweeted. Dogecoin surged more than 50%,2021-02-04
667,"Stimulus Checks, PayPal, Dogecoin, Merck, Ford - 5 Things You Must Know Thursday",2021-02-04
668,"Jim Cramer on Apple Car, Dogecoin, Nokia, Kohl's and Stock Market Thursday",2021-02-04
669,"Ethereum, DOGE on Own Journeys as Inflation Bets Fuel Bitcoin - CoinDesk",2021-02-04
670,"Dogecoin, DeFi, Musk And The Bitcoin Vertical – What Now?",2021-02-09
671,Dogecoin Cryptocurrency Soars Due To Elon Musk Tweets ...,2021-02-09
672,Dogecoin (DOGE) Search Volume on Baidu Explodes to 10x of 2017 Levels,2021-02-09
673,KRONOS ADVANCED TECHNOLOGIES FILES FOR ...,2021-02-09
674,Dogecoin Shares a Surprising Amount in Common With Ancient Forms of Currency,2021-02-09
675,Rock Star Gene Simmons Shows Love for Dogecoin,2021-02-09
676,Dogecoin Price Forecast: DOGE primed for a 30% rally to new ...,2021-02-09
677,"Cryptocurrencies Price Prediction: Ethereum, Ripple and Dogecoin – European Wrap 9 February",2021-02-09
678,'Big Short' investor Michael Burry says Tesla's $1.5 billion bet ...,2021-02-09
679,Bitcoin bull Mike Novogratz warns that 'greed and gravity ...,2021-02-09
680,Elon Musk says he supports top dogecoin holders selling most of their coins,2021-02-14
681,What Does Dogecoin Have to Do With Government Crypto Bans? - CoinDesk,2021-02-14
682,‘Doge Is Underestimated’—Elon Musk’s ‘Fav’ Bitcoin Rival Dogecoin Is Getting A Surprise Upgrade,2021-02-14
683,Jake Paul Endorses Dogecoin After Revealing Fortune From His 8-Year Long Bitcoin Investment,2021-02-14
684,Top Crypto Quotes of the Week: Feb. 7 to Feb. 14,2021-02-14
685,Dogecoin ($DOGE) Creator Sold His Crypto in 2015 ‘To Buy a Used Honda Civic’,2021-02-14
686,Elon Musk tweets on Dogecoin - too much concentration,2021-02-14
687,Elon Musk Predicted Starlink Would Generate $30 Billion in Revenue. Don't Believe It.,2021-02-14
688,'Black Swan' Author Pulls a 180- Nassim Taleb Says 'Bitcoin's ...,2021-02-14
689,Transaction fees on Dogecoin (DOGE) surge to unprecedented levels,2021-02-19
690,Correction: Kronos Advanced Technologies Selects BOTS Inc (OTC:BTZI) to Develop a Next-gen Dogecoin Mining rig for Installation in the KNOS Flagship Line of Air Purifiers AirDoge,2021-02-19
691,Student Opinion: The Rise of Dogecoin Shows the Growing ...,2021-02-19
692,Will Dogecoin Ever Be Capped? An Explanation of How Many ...,2021-02-19
693,Crypto exchange CEO is surprised Elon Musk is so into Dogecoin,2021-02-19
694,Musk's Dogecoin Army Recruit Gene Simmons Turns Cardano Adherent — Here's Why,2021-02-19
695,Kronos Advanced Technologies Selects BOTS Inc to Develop a Next-gen Dogecoin Mining rig for Installation in the KNOS Flagship Line of Air Purifiers AirDoge,2021-02-19
696,Dogecoin Price Prediction: DOGE targets massive rebound ...,2021-02-19
697,"‘Crypto’: Hidden from view, yet on everyone’s lips",2021-02-19
698,Why So Many Rappers Are Getting Into Cryptocurrency,2021-02-19
699,Dogecoin jumps 25% after a one-word Elon Musk tweet about ...,2021-02-24
700,Dogecoin Price Predictions: Can Musk Take DOGE 'Literally' to the Moon?,2021-02-24
701,Forget Dogecoin; Buy This Electric Car Stock Instead,2021-02-24
702,Elon Musk says Dogecoin is going to the moon in latest tweets touting the cryptocurrency,2021-02-24
703,Is Elon Musk WRONG About Dogecoin?,2021-02-24
704,Elon Musk's Tweet About Dogecoin Sends Price Up 10% In 30 Minutes Again,2021-02-24
705,An Interview with a Dogecoin Core Developer,2021-02-24
706,"Binance coin (BNB), Dogecoin (DOGE) rekindle as they record double digit gains - Morning Tick",2021-02-24
707,Klarna's CEO is 'deeply worried' about tweets promoting bitcoin and thinks regulators should step in,2021-02-24
708,"Monero, Augur, Dogecoin Price Analysis: 24 February",2021-02-24
709,"Dogecoin Has A 'Meme Shield' Against Price Drops, Says Elon Musk",2021-03-01
710,"Billionaire Bitcoin Battle: Elon Musk Praises Crypto, Bill Gates Warns Investors to 'Watch Out'",2021-03-01
711,"Elon Musk Trolls SEC with ""Dogecoin Meme""",2021-03-01
712,"CoinFlip Lists Dogecoin Across Its Network of 1,800 ATMs ...",2021-03-01
713,Dogecoin Struggles to Resume Uptrend Despite Renewal,2021-03-01
714,"Dogecoin Gets Core Update To Improve Speed, Mempool Expiry Time; Social Media Overjoyed",2021-03-01
715,Elon Musk Reportedly Investigated by the SEC Over Dogecoin ...,2021-03-01
716,"Petition Asking Amazon to Accept Dogecoin Signed by Almost 100,000 People",2021-03-01
717,"Bots Encouraged Buying of GameStop, Dogecoin in Meme Trading Craze: Report - CoinDesk",2021-03-01
