,title,datetime
0,"Taylor Swift Channels 'Childhood Hero' at New Year's Eve Costume Party With Blake Lively, Gigi Hadid: Pics!",2019-01-01
1,Lindsay Lohan Surprises Her Hard-Partying Staff in 'Beach Club' Sneak Peek,2019-01-01
2,OpenNode Rejects Roger Ver’s $1.25 Million Investment Offer,2019-01-01
3,Did Rishabh Pant become baby-sitter for Tim Paine’s family?,2019-01-01
4,"Hashtag Trending: Everyone using cryptocurrency, a cashless world, and payment data is king",2019-01-01
5,"Netflix Delete Tweet Saying The Punisher Season 2 Release Date Is January 18th, 2019",2019-01-01
6,Markets Update: Crypto Traders Enter the New Year With ...,2019-01-01
7,"Coming To Grocery Shelves In 2019: Mushroom/Meat Mixes, Pea Protein And Banana Milk",2019-01-01
8,How Institutional Investors Are Changing the Cryptocurrency ...,2019-01-01
9,Report: Indian Government Updates Progress on Crypto ...,2019-01-01
10,Glenn Close Gets Standing Ovation After Winning Best Actress in Major Golden Globe Upset,2019-01-06
11,Sandra Oh Gives Powerful Speech About 'Moment of Change' in Golden Globes Monologue With Andy Samberg,2019-01-06
12,Christian Bale Thanks 'Satan for the Inspiration' During Golden Globe Win for Playing Dick Cheney,2019-01-06
13,30th International Kite Festival: Vibrant colours covers Gujarat skies,2019-01-06
14,10 of Top 15 Crypto Assets Show Price Correlation of Over 64%,2019-01-06
15,AFC Asian Cup football: Huge triumph for India as they beat Thailand by 4-1,2019-01-06
16,Crypto Exchange Kraken Received 475 Disclosure Requests from Regulators in 2018,2019-01-06
17,Amazon's 5 Biggest Challenges in 2019,2019-01-06
18,In Pictures | Blanket of snow covers north India,2019-01-06
19,Kumbh Mela 2019: Luxury tents set up in Prayagraj,2019-01-06
20,Weight Watchers Sinks on JPMorgan Downgrade,2019-01-11
21,"Megyn Kelly Officially Leaves NBC, Reportedly With the Rest of Her $69 Million Contract",2019-01-11
22,Jamie Dornan's One-Night Stand Gets Messy in 'Untogether ...,2019-01-11
23,"Evening Shadows movie: Review, cast, director",2019-01-11
24,Fair wind behind Hawk Yachts,2019-01-11
25,"Researchers Find Vulnerability for Bitcoin, Ethereum, and Ripple Digital Signatures in Faulty Implementations",2019-01-11
26,"Do drug treatment facilities really lower property values? Finally, an answer",2019-01-11
27,"Happy Birthday Rahul Dravid: Wishes pour in from fans all over the world, sweetest one from Sehwag",2019-01-11
28,ISRO Chairman Shri K. Sivan speaks of achievements in 2018,2019-01-11
29,CES Takeaway: Get Ready for 'Digital Cockpit' Car Displays,2019-01-11
30,"Despite Government Shutdown, Hyundai, Kia Issue Vehicle Recall for Risk of Engine Fire",2019-01-16
31,Roku Ditches Alex Jones and InfoWars Following Intense Backlash,2019-01-16
32,Phil Roach to Head up Chasing Returns’ Global Sales Team,2019-01-16
33,Microsoft fixes Windows 10's Wi-Fi hotspot problems and closes app snooping loophole,2019-01-16
34,Pound exchange rate news: Why did GBP rally after Theresa May Brexit defeat?,2019-01-16
35,Hina Khan’s black Avtaar will drive you crazy; See pics,2019-01-16
36,"Justice Sanjiv Khanna, Dinesh Maheshwari elevated to Supreme Court",2019-01-16
37,PM Modi-led selection committee likely to appoint new CBI director on January 24,2019-01-16
38,"Vitalik v/s CZ Isn’t Over, Binance CEO mocks Vitalik After Ranking First Among 100 Most Influential Crypto People",2019-01-16
39,"#10yearchallange is the latest fad on FB, Twitter and Instagram. You can also be part of it…..",2019-01-16
40,Dogecoin Mining Pools - Is It Worth?,2019-01-21
41,Ja Rule Responds to Fyre Festival Criticism After Documentaries Air: ‘I Too Was Hustled',2019-01-21
42,These are five high-paying programming jobs right now,2019-01-21
43,Refinitiv Hires Sherry Madera to Head Industry and Govt Affairs,2019-01-21
44,Horizon Appoints Philippe Thomas as Advisor,2019-01-21
45,Saxo Bank Names Fan Xu as New CEO of Greater China,2019-01-21
46,Marex Spectron Acquires UK Broker CSC Commodities,2019-01-21
47,"Punjab: Man scales wall to enter zoo, killed by lions",2019-01-21
48,"Shivakumara Swamiji of Tumkuru Siddganga Mutt passes away, aged 111",2019-01-21
49,Mastermind Who Planned Iceland's Biggest Bitcoin Heist ...,2019-01-21
50,"Cyber Saturday—Data Privacy in Davos, Facebook Chat Changes, Google’s GDPR Fine",2019-01-26
51,India’s Military might on display at Grand Republic Day Parade,2019-01-26
52,DApp Battle: Tron [TRX] Races Ahead Of Ethereum As Six Tron Dapps Find Place In Top 10 Ranking,2019-01-26
53,Grin’s Price Explodes Over 100% as New Exchanges Add the Privacy Coin,2019-01-26
54,Scientists find the Earth's oldest rock in lunar sample returned from the moon,2019-01-26
55,"Mehul Choksi to be brought back? Long-range Air India flight with ED, CBI officials may head for West Indies",2019-01-26
56,Brazil orders Vale to halt Corrego do Feijao operations after dam burst,2019-01-26
57,"Happy Republic Day: Mohanlal to AR Rahman, South stars wish fans",2019-01-26
58,BitMEX: Its Auto-Deleveraging System and the Growing Size of Its Insurance Fund,2019-01-26
59,An In-Depth Look at the Trezor Model T Hardware Wallet ...,2019-01-26
60,'Survivor' Season 38 Cast: Meet the New and Returning Castaways of 'Edge of Extinction!',2019-01-31
61,Justin Timberlake Shares Funny Video of Jessica Biel Sleeping on His Birthday Date Night,2019-01-31
62,The programming languages and skills that pay the best in 2019,2019-01-31
63,Nearly Half of All U.S. Adults Have Some Form of Cardiovascular Disease,2019-01-31
64,"Less People Are Getting Sick or Injured in Hospitals, Report Says",2019-01-31
65,'Good Trouble' Sneak Peek: Stef and Lena Discover Dirty Truths About Callie and Mariana's Digs (Exclusive),2019-01-31
66,KPN Shares Surge After Report Says Brookfield Asset ...,2019-01-31
67,Circle Expands USDC Ecosystem to Over 100 Partners,2019-01-31
68,Alipay and Wechat Pay Order Huobi to Remove Payment Options,2019-01-31
69,Binance Users Can Now Pay for Crypto With Credit Cards - CoinDesk,2019-01-31
70,Learning a programming language? These are the most in-demand tech jobs and skills of 2019,2019-02-05
71,Megyn Kelly Poses With Kathie Lee Gifford Following Her 'Today' Show Departure,2019-02-05
72,Amyris News: AMRS Stock Explodes on Cannabinoid Deal,2019-02-05
73,A Technical Breakdown Of Google's New Blockchain Search ...,2019-02-05
74,Microsoft: The Undervalued Elephant in the Room,2019-02-05
75,These Are Trump’s Guests for the 2019 State of the Union Address,2019-02-05
76,Drugmakers Blame Middlemen for High Prices But Still Make Huge Profits,2019-02-05
77,Who Democrats Invited to Trump’s State of the Union Address,2019-02-05
78,Angela Ahrendts Is Leaving Apple,2019-02-05
79,Revealed: The difference in pay at US and European banks,2019-02-05
80,Bebe Rexha Has 'Princess' Moment at GRAMMYs in Monsoori After Being Called 'Too Big' by Other Designers,2019-02-10
81,Kacey Musgraves Pays Tribute to Her Album Cover With Valentino Gown at 2019 GRAMMYs,2019-02-10
82,Shawn Mendes Addresses Possible Collaboration With Miley Cyrus (Exclusive),2019-02-10
83,Ricky Rebel Wears Pro-Trump Jacket at 2019 GRAMMYs,2019-02-10
84,Why Musicians Should Get Political,2019-02-10
85,Paintings Said to Be by Adolf Hitler Fail to Sell at German Auction,2019-02-10
86,Yamaha MT-15 launch in India: Here is all you need to know,2019-02-10
87,"This Valentine – Join Karle, Bajrang Dal",2019-02-10
88,Abu Dhabi includes Hindi as the third official court language,2019-02-10
89,Is It #BUIDL That Will Decide Next Amazon of Cryptoworld or Most Cryptocurrencies will die?,2019-02-10
90,Discuss the future of blockchain with Dogecoin and more at TNW2019,2019-02-15
91,Study: The 4 software development trends that will dominate 2019,2019-02-15
92,McDonald's Shamrock Shake Returns: 7 Things to Know,2019-02-15
93,Bradley Cooper Says He Will Not Perform 'Shallow' as Jackson Maine at the Oscars,2019-02-15
94,Why 'Alita: Battle Angel' Star Rosa Salazar Is 'Galvanizing' Latinx Culture in Film (Exclusive),2019-02-15
95,Charlize Theron Shows Ellen DeGeneres and Seth Rogen How She Learned to Kiss,2019-02-15
96,Christy Carlson Romano Reveals How New 'Kim Possible' Movie Is a 'Throwback' to the Series (Exclusive),2019-02-15
97,CFTC Brings Fraud Charges Against FX Trader Kelvin Ramirez,2019-02-15
98,"Binance Removing CLOAK, MOD, SALT, SUB, and WINGS: Industry-Wide Delisting Trend",2019-02-15
99,BaFin to Deepen Deutsche Bank Money Laundering Investigation,2019-02-15
100,"Ethereum Creator Vitalik Buterin Reveals his Crypto Holdings which Include Dogecoin, Bitcoin cash (BCH), Zcash (ZEC) and others",2019-02-20
101,America Ferrera on How Eva Longoria and Friends Have Become Her 'Saving Grace' as a Mom (Exclusive),2019-02-20
102,Binance Launches DEX Testnet for Peer-to-Peer Crypto Trading,2019-02-20
103,Editorial Policy,2019-02-21
104,IPC Systems Taps ICE’s Cryptocurrency Price Feeds,2019-02-20
105,Tesla Is Gearing Up To Allow Customers To Lease The Model 3,2019-02-20
106,"Lockheed Martin unveils ‘F-21’ fighter jet for India, from India",2019-02-20
107,Why Cryptocurrency Market Cap Doesn’t Matter,2019-02-20
108,Dogecoin Declines gradually,2019-02-20
109,"3 Things to Know at Market Close: CVS, Okta CEO and the Pesky Retail Numbers",2019-02-20
110,3 of the Best Trades for the Week,2019-02-25
111,GE’s Turnaround Plan Gets a Boost With $21.4 Billion Sale of Biopharma Unit to Danaher,2019-02-25
112,"FCA, BoE, CFTC Agree on Derivatives Market Post-Brexit Measures",2019-02-25
113,A Big Acquisition Could Boost Amazon Stock,2019-02-25
114,Caesars Acquires Equity Stake In DraftKings For Licensure Help,2019-02-25
115,Russia plans oil-based cryptocurrency to dodge US sanctions,2019-02-25
116,PR: Roger Ver Joins Livenpay Advisory Board – Press release ...,2019-02-25
117,Fetch.AI Token Sale Raised $6M In Seconds,2019-02-25
118,"AWS comes to Sprint Curiosity IoT platform for enterprise traffic routing, processing, data storage",2019-02-25
119,Lovers Malaika Arora and Arjun Kapoor cosy up at Akash Ambani wedding bash in Swiss Alps,2019-02-25
120,Patrick J. Adams Reveals Whether He'll Return for 'Suits' Final Season (Exclusive),2019-03-02
121,Patrick J. Adams Jokes His and Meghan Markle's Kids Will Have Playdates at 'Her House' (Exclusive),2019-03-02
122,Defence Minister Nirmala Sitharaman meets Wing Commander Abhinandan | PICS,2019-03-02
123,SpaceX Rocket With Unmanned US Capsule Blasts Off for Space Station,2019-03-02
124,"Dhoni, Jadhav power India to victory in 1st ODI against Australia",2019-03-02
125,How to Use Multisig to Keep Your Coins Ultra-Safe – Wallets ...,2019-03-02
126,‘RSS: Building India Through Sewa’: Sudhanshu Mittal’s book highlights sacrifices made by the Sangh (Video),2019-03-02
127,"UP ‘Bhulekh’ project, steered by Pravir Kumar, wins National Award (gold) for e-governance",2019-03-02
128,Bitcoin Cash Supporter Convinces Chess.com to Accept BCH ...,2019-03-02
129,"Ripple’s Investment in Kava Labs, a headstart for Kava’s or a smart business Idea of Ripple ...",2019-03-02
130,Sophie Turner Gushes Over Fiance Joe Jonas and BFF Maisie Williams,2019-03-07
131,EDIFIER S880DB: Versatile speakers for work and play,2019-03-07
132,"Microplastic Polluting Rivers and Seas Across the Globe, Says New Research",2019-03-07
133,Meghan Markle's Best Friend Jessica Mulroney Explains How the Duchess Saved a Fashion Brand,2019-03-07
134,French Finance Committee Recommends to Ban Privacy Coins,2019-03-07
135,Twitter boss Jack Dorsey bolsters Bitcoin with massive buy-up,2019-03-07
136,Co-Founder of 360T Named as Adviser to Group Executive Board,2019-03-07
137,Nintendo doesn't want to over-monetize gamers,2019-03-07
138,"MY BESPOKE ROOM: FEMALE-run firm beat gender-funding bias, making luxury design affordable",2019-03-07
139,Combat-worthy Army officers to be shifted from HQ to front units,2019-03-07
140,How the RealSelf digital platform is transforming beauty tech,2019-03-12
141,Lupita Nyong'o Reveals Why She Felt 'Panicked' While Making 'Us' (Exclusive),2019-03-12
142,"Microsoft's new AI Business School teaches execs how to lead AI initiatives, for free",2019-03-12
143,Cole Sprouse Opens Up About How 'Riverdale' Will Handle Luke Perry's Death,2019-03-12
144,Active Development for Most Bitcoin Forks Evaporates ...,2019-03-12
145,"More Than 12,000 Cases of Pillsbury Flour Recalled Over Salmonella Worries",2019-03-12
146,"Why Throwback Hair Accessories Are Cool Again -- Scrunchies, Headbands & More!",2019-03-12
147,"4 Crypto Assets Break Above Key Moving Average, Leaving Bitcoin Behind - CoinDesk",2019-03-12
148,'A Fintech Bank': Deltec International Looks To Make The ...,2019-03-12
149,"‘Facebook Coin’ Might Bring $19 Billion in Revenue, Barclays Predicts",2019-03-12
150,"Ethereum Leads in Active Developers, Bitcoin’s Developer Count Healthy, Litecoin and Dogecoin “Being Abandoned”",2019-03-17
151,Malika Haqq Gives Update on Khloe Kardashian Post Breakup: 'She's Doing Really Good' (Exclusive),2019-03-17
152,How to Boot Into Safe Mode,2019-03-17
153,Why Most Educated People Fail to Understand Bitcoin,2019-03-17
154,Goa CM Manohar Parrikar dies after prolonged battle with pancreatic ailment,2019-03-17
155,"ANGI Homeservices' New CFO Discusses Share Gains, Millennials, M&A and More",2019-03-17
156,Another Way to Hedge Tech Stock Volatility,2019-03-17
157,Is Vail Resorts a Buy?,2019-03-17
158,PR: CoinAll Lists Fetch.AI and Offers a 350000 FET Giveaway ...,2019-03-17
159,Apple Watch and Fitbit can cause rashes and boils as they are ‘perfect breeding ground for bacteria’...,2019-03-17
160,Papa John's News: PZZA Stock Heats Up on New Board Member Shaquille O'Neal,2019-03-22
161,RuPaul's Drag Race Season 11 Episode 4 Recap and ...,2019-03-22
162,Thandie Newton and Her 14-Year-Old Daughter Nico Parker Look Nearly Identical at 'Dumbo' Premiere,2019-03-22
163,"95% Of Reported Bitcoin Trading Volume Is Fake, Says Bitwise",2019-03-22
164,Ethereum Creator Vitalik Buterin Reveals his Fiat Holdings and Charity Donations,2019-03-22
165,Special Olympics 2019: India finish campaign with 368 medals in kitty,2019-03-22
166,Hibbett Sports Surges After Handily Beating Earnings Estimates,2019-03-22
167,Pound US dollar exchange rate: GBP fluctuates as May granted short Article 50 extension,2019-03-22
168,Intel's new Graphics Command Center application looks BOSS,2019-03-22
169,Pound LIVE: GBP higher against WEAKENED euro – eurozone manufacturing DRAGS DOWN bloc,2019-03-22
170,"Litecoin (LTC) and Dogecoin are ""Being Abandoned"" by Developers according to Report",2019-03-27
171,No Joke - Fatburger Is Rebranding as Skinnyburger,2019-03-27
172,"This Raspberry Pi rival is on sale now: $63 Odroid-N2 promises more speed, USB 3.0, Android 9, 4K video",2019-03-27
173,Jersey Mike's Day of Giving 2019: 13 Things to Know,2019-03-27
174,Dogecoin Can Be a Good Choice in Volatile Crypto Space,2019-03-27
175,Ferrari P80/C: One-Off Racecar Took 4 Years to Complete,2019-03-27
176,Scotland’s ESpark lands in Bermuda tax haven,2019-03-27
177,How to Print Your Own Bitcoin Cash Paper Wallet – The Daily ...,2019-03-27
178,Chhapaak hero Laxmi Agarwal dances to Baaghi song. New TikTok viral video,2019-03-27
179,WellCare's stock jumps 23% after Centene announces merger valued at $17.3 billion,2019-03-27
180,Dogecoin Begins Its Ascent! (DOGE/USD Monthly Price Analysis: March 2019),2019-04-01
181,Dogecoin Price Gains Over 17% as the Pump is in Full Effect,2019-04-01
182,Felicity Huffman Steps Out Smiling Amid College Admissions Scandal,2019-04-01
183,Three reasons you might enjoy the Go programming language and three reasons you might not,2019-04-01
184,Is Hailey Bieber Really Pregnant? Justin Shares Photo From Doctor's Office on April Fools' Day,2019-04-01
185,"FXSpotStream, Fastmatch Kick Off FX Volume Reports for March",2019-04-01
186,How Diversity of Opinion Makes This Digital Educator a Better CEO,2019-04-01
187,National Post editor-in-chief Anne Marie Owens to step down in April,2019-04-01
188,Broken Phone? Don't Sweat It — Restore a Bitcoin Wallet in ...,2019-04-01
189,"Police investigate homicide after finding body at 67th, Walrond",2019-04-01
190,"Cosmos Network Now Has Nearly 100 Validators, 6-7 Second Block Times",2019-04-06
191,Bollywood celebrities extend wishes on Gudhi Padwa,2019-04-06
192,Binance CEO Slams CoinMarketCap’s Top Crypto Exchanges on Highest Volume,2019-04-06
193,Fiat vs Crypto: Ethereum Founder Vitalik Buterin Challenge ...,2019-04-06
194,Uyen T Nguyen: The Powerful Young Woman Behind the ...,2019-04-06
195,How to unlock an iPhone if you don’t know the password...,2021-03-11
196,Cryptoradar Finds Best Prices Across Exchanges and Brokers ...,2019-04-06
197,Timeless: The Powell Doctrine in the Era of the Forever Wars,2019-04-06
198,How To Update The Address Given On Your PAN (Permanent Account Number) Card,2019-04-06
199,Bitcoin (BTC) Price Prediction: What to Expect from?,2019-04-06
200,Barack Obama Writes Letter Praising Nipsey Hussle That Was Read at Memorial Service,2019-04-11
201,Trade of the Day: Apache Stock Looks Ripe to Gush Higher,2019-04-11
202,Nikki Bella Reacts to Seeing Ex-Fiance John Cena Out With Another Woman,2019-04-11
203,Whoops! American Airlines Flight Attendant Spills Drink on Company’s CEO,2019-04-11
204,There’s an Exciting Tech Company IPO This Week–and it’s Not Uber,2019-04-11
205,Binance partners with CipherTrace to enhance anti-money laundering compliance,2019-04-11
206,Coinbases New Debit Card Lets You Spend Crypto Anywhere That Visa Is Accepted,2019-04-11
207,Simple Bitcoin Widget Gives You Crypto Prices on the Go ...,2019-04-11
208,Pound latest: What will happen to GBP now Brexit delay is granted? Will Sterling rise?,2019-04-11
209,India rupee RISES against US dollar as country prepares to vote in Indian elections,2019-04-11
210,The creator of Python on how the programming language is learning from TypeScript,2019-04-16
211,Wendy Williams on Whether She Would Ever Get Married Again,2019-04-16
212,Eye on A.I.— Why Video Games Are Key to Better A.I.,2019-04-16
213,Data Sheet—Measuring the Legacy of Foxconn CEO Terry Gou,2019-04-16
214,There may be a copy of Wikipedia somewhere on the moon. Here's how to help find it.,2019-04-16
215,MOEX CEO Alexander Afanasiev to Step Down in May,2019-04-16
216,MetaQuotes Acquires Russian Digital Marketing News Website,2019-04-16
217,What Is SWIFT and How Is It Used in 2019?,2019-04-16
218,Canopy Growth Buys Spanish Cannabis Company Cafina in All-Cash Deal,2019-04-16
219,Review: BC Vault Is an Unorthodox Hardware Wallet With a ...,2019-04-16
220,Dogecoin Price Prediction 2019: How Dogecoin (DOGE) Went ...,2019-04-21
221,"Dogecoin Creator Jackson Palmer, Bids Farewell to Twitter and Youtube",2019-04-21
222,Kanye West Brings His Sunday Service to Coachella With Daughter North and Family In Attendance,2019-04-21
223,Bitcoin is one of the best-performing assets of 2019,2019-04-21
224,Google’s Doodle: Easter Egg Dyeing and Carving,2019-04-21
225,CZ: Binance Chain Does Not Challenge Ethereum,2019-04-21
226,Green Apple: Environment a Key Priority,2019-04-21
227,Indiana Family Worried About Bitcoin-Rich Seasteader Wanted by Thai Authorities,2019-04-21
228,Lok Sabha elections: AAP declares candidates for three seats in Haryana,2019-04-21
229,The Naked Deli unveils plans for more North East restaurants after city centre sites expand,2019-04-21
230,Dogecoin News Update: Dogecoin Price Prediction 2019 ...,2019-04-26
231,Smartphone Wallpaper Lets You Track the Price of Your ...,2019-04-26
232,"Kylie Jenner, Travis Scott and Stormi Dress Up as 'Avengers: Endgame' Superheroes for Rapper’s Birthday Party",2019-04-26
233,"Programming languages: JavaScript developers reveal their favorite frameworks, platforms, and tools",2019-04-26
234,GAIN Capital’s Revenues Per Million Slide to $50 in Q1,2019-04-26
235,SBI CEO Yoshitaka Kitao Joins Ripple’s Board,2019-04-26
236,Hamas Military Wing Raising Money Through Bitcoin,2019-04-26
237,Indian Government Again Discussing Ban on Cryptocurrencies: Report - CoinDesk,2019-04-26
238,"Bitcoin and gold, why Warren Buffett doesn’t invest in either",2019-04-26
239,This Blockchain Startup Launches Diamond-Backed Token ...,2019-04-26
240,SpaceX Coin Elon Musk Gets Pitched | Forex News,2019-05-01
241,Coinbase Wallet Welcomes Dogecoin (DOGE) as the Next Available Crypto Asset,2019-05-01
242,"Alex Trebek Says He's 'Fighting Through' Cancer Battle, But Has 'Surges of Deep, Deep Sadness'",2019-05-01
243,Jaden Smith to Play Young Kanye West in Showtime Anthology Series 'Omniverse',2019-05-01
244,"Why Meghan Markle and Prince Harry Unfollowed William, Kate and Rest of Royal Family on Instagram",2019-05-01
245,Trade of the Day: MasterCard Stock Is Going Parabolic,2019-05-01
246,Jack Wagner Felt 'Five Stages of Grief' After Lori Loughlin's 'When Calls the Heart' Exit (Exclusive),2019-05-01
247,Naxals torch 3 dozen vehicles in Gadchiroli on Maharashtra Day,2019-05-01
248,Luckin Coffee -- The Chinese Not-Starbucks,2019-05-01
249,Cardi B Takes ET Behind the Scenes of Her Sexy New Campaign Shoot With Fashion Nova (Exclusive),2019-05-01
250,How to enable the hidden preview pane in Gmail,2019-05-06
251,Diana Ross Says She Was 'Violated' By TSA at New Orleans Airport,2019-05-06
252,New 'Spider-Man: Far From Home' Trailer Reveals Life After ...,2019-05-06
253,Here Are 5 Apple iOS 13 Features You Can Get Right Now,2019-05-06
254,Sophie Turner and Richard Madden Have Super Sweet 'Game of Thrones' Reunion at Met Gala 2019,2019-05-06
255,Miley Cyrus and Liam Hemsworth Attend First Met Gala Together,2019-05-06
256,Bored? John McAfee’s New App Will Harass & Reward You in BTC,2019-05-06
257,Mitrade Launches Proprietary Trading Platform,2019-05-06
258,RoboForex Receives Regulatory License in Belarus,2019-05-06
259,Warsaw Stock Exchange Reports Weak Volumes for April 2019,2019-05-06
260,xCrypt to Host IEO on Path to Security Token Offering ...,2019-05-11
261,First Batch of Ledger Nano X Hardware Wallet to Be Shipped on May 15,2019-05-11
262,HTC Integrating Full Bitcoin Node Into Surprise New Smartphone,2019-05-11
263,Google sheds light on Fuchisa OS,2019-05-11
264,Sound Advice: Speed Queen remains the most dependable ...,2019-05-11
265,Three Very Different Paths to Blockchain Scaling – Featured ...,2019-05-11
266,"[UPDATE] Bitcoin Surges To Over $7,000--Here's Why",2019-05-11
267,Markets Update: Crypto Bulls Outpace Stocks and Gold ...,2019-05-11
268,"Critics don't like me because of my colour, Sajid Javid says after online abuse from far right and left",2019-05-11
269,Indian Crypto Traders Undeterred by Ban Rumor – Regulation ...,2019-05-11
270,Trump Slams De Blasio After 2020 Presidential Announcement,2019-05-16
271,Crypto Briefing Pundi X Price Analysis NPXS / USD: Uptown ...,2019-05-16
272,eBay Denies Rumors of Accepting Crypto as Payment,2019-05-16
273,"Fortune 500, Beyoncé Uber, Alabama Abortion: Broadsheet May 16",2019-05-16
274,Breaking: First Case of Australian Broker Refunding Overseas Clients,2019-05-16
275,"Opinion: NASCAR drivers view All-Star Race fan vote as good news, bad news",2019-05-16
276,"Gold, The Fed And Democracy: How Peter Schiff Leads Commentary Surrounding The US Economy",2019-05-16
277,Cryptopia Exchange Users React as it Announces Halt in Deposits,2019-05-16
278,Deutsche Bank doubles financial crime fighters to head off ...,2019-05-16
279,"Junk Loans, Now at $1.2 Trillion, Could Haunt U.S. Banks, Top Regulator Warns",2019-05-16
280,Crypto News Today: Dogecoin (DOGE) and Basic Attention ...,2019-05-21
281,Jonas Brothers Rock Out With 'Cool' Performance on 'The Voice' Season 16 Finale,2019-05-21
282,See Jason Momoa's NSFW Reaction to the 'Game of Thrones' Finale,2019-05-21
283,Jenelle Evans Left in Tears During 'Teen Mom 2' Reunion,2019-05-21
284,"Kraken is Offering Preferred Shares, Raises $6.8 Million in a Day",2019-05-21
285,Cryptocurrency scams TRIPLE in a year – how you can avoid being ripped off as £27m lost,2019-05-21
286,"JPMorgan finally admits Bitcoin has value, here is how they measure it",2019-05-21
287,Jamie Oliver restaurants COLLAPSE into administration - all but THREE branches shut down,2019-05-21
288,SC dismisses PIL on 100% matching of VVPAT slips with EVMs,2019-05-21
289,What Is Capital Budgeting? Definition and Examples,2019-05-21
290,Will Dogecoin Ever Go Up? Dogecoin's Inflation Problem ...,2019-05-26
291,Carson Kressley Gets a Fabulous Drag Makeover From Trinity 'The Tuck' Taylor at RuPaul's DragCon LA 2019,2019-05-26
292,Some Tesla stations to limit supercharging to 80% at busy stations to reduce wait times,2019-05-26
293,"Before swearing-in for the second term, PM Modi visits mother Hiraba, seeks blessings",2019-05-26
294,French Open: 3-time Grand Slam champion Angelique Kerber crashes out in first round,2019-05-26
295,ICC Cricket World Cup 2019: Jason Roy hopeful of England posting a 500-run total,2019-05-26
296,Justin Sun’s Recent “Amazing” Announcement Boosts Tron (TRX) To A 7% Price Surge,2019-05-26
297,"Meet 25-year-old Chandrani Murmu, the youngest Member of Parliament",2019-05-26
298,"Newcastle medical firm secures £340,000 grant to fund its fight against tuberculosis",2019-05-26
299,"How to Find ""Pre-IPO"" Marijuana Stocks",2019-05-26
300,Dogecoin Outperforms Bitcoin By 5% As Altcoin Season ...,2019-05-31
301,SBI Plans Launch of In-Store Payments With Ripple-Powered 'Money Tap' App - CoinDesk,2019-05-31
302,Cryptocurrencyalerting.com Will Notify You of Price ...,2019-05-31
303,Coinbase President Asiff Hirji is second executive to leave firm this month,2019-05-31
304,"Craig Wright’s libel lawsuit could cost Peter McCormack up to £750,000",2019-05-31
305,7 Stocks for You to Profit From (Legal) Insider Trading,2019-05-31
306,Coinstar lets consumers purchase bitcoin with cash in 2200 ...,2019-05-31
307,Pound euro exchange rate: GBP steadies as UK mortgage approvals jump,2019-05-31
