,title,datetime
308,FirstGroup plots UK bus Greyhound sale,2019-05-31
309,"Listing in Hong Kong Could Help Alibaba, But It May Not Help BABA Stock",2019-05-31
310,Joe Jonas Says It Felt 'Nice' to Receive Apology from Ex Taylor Swift,2019-06-05
311,Nasdaq to Provide Microsoft With Real-Time Equity Market Data,2019-06-05
312,"Samaritan developer returns $500,000 worth of Ethereum to rightful owner",2019-06-05
313,"Elon Musk says Tesla cars could support third-party apps, games",2019-06-05
314,There's 100 Unclaimed Bitcoin Cash Wallets Hidden ...,2019-06-05
315,PM Modi urges citizens to make yoga an integral part of their lives,2019-06-05
316,Doing Something Wright: Why is BSV Going to the Moon?,2019-06-05
317,Wickes advert BANNED after 50 percent discount offered after raising prices on SAME DAY,2019-06-05
318,PR: Monarch Wallet Updates Bring SLP Support – Press ...,2019-06-05
319,Vera Bradley Surges as First-Quarter Revenue Tops Estimates,2019-06-05
320,DOGE Lack Of Correlation Could Offer Traders Market ...,2019-06-10
321,It’s Hip To Be a Square Stock Investor,2019-06-10
322,Vanessa Hudgens and Austin Butler Couple Up at 'The Dead Don't Die' Premiere,2019-06-10
323,Bakyt Azimkanov Joins Cardano Foundation as a Director,2019-06-10
324,"What Divides America? Job Skills, Says IBM CEO",2019-06-10
325,Why bitcoin still hasn’t experienced a pullback as analysts predicted,2019-06-10
326,"Cosmos Code Review: Dammit, Time To Build",2019-06-10
327,Yogi Adityanath visits Mulayam Yadav at his Lucknow residence,2019-06-10
328,Ars Technica staffer busted hunting CHILDREN for sex online,2019-06-10
329,Brexit win as UK nails trade deal with South Korea – and it didn’t take seven years,2019-06-10
330,Above $9.3K: Bitcoin's Price Prints 13-Month High - CoinDesk,2019-06-15
331,Dogecoin price analysis 15 June 2019; A strong purchase incentive coming up | Cryptopolitan,2019-06-15
332,Delhi: Sessions court to hear Monty Chadha’s second bail plea on June 17,2019-06-15
333,DRYROBE: Surfers' favourite beach kit breaks into schools and sports markets,2019-06-15
334,Symphony in the Flint Hills canceled due to storm damage,2019-06-15
335,Former PM Dr Manmohan Singh chairs meeting with CM of Congress-ruled States in New Delhi,2019-06-15
336,Fibonacci & Lucas Trading Levels,2019-06-15
337,Bitcoin scam from South Africa is reeling in $135k per day,2019-06-15
338,Algunos consejos para aceptar criptomonedas en tu negocio,2019-06-15
339,"Dogecoin plunges after rally, sparking outcry on Reddit",2021-02-01
340,Ben Affleck Making Sure He's 'Healthy' Before Dating Again as Jennifer Garner Spends More Time With Boyfriend,2019-06-20
341,'Good Trouble' Co-Creator Teases Fallout From Season 2 Premiere (Exclusive),2019-06-20
342,'RHOC' Star Tamra Judge's Husband Eddie Reveals His Heart ...,2019-06-20
343,Pound US dollar exchange rate: GBP rises as a dovish Fed signals rate cuts,2019-06-20
344,Phunware Launches PhunCoin Cryptocurrency,2019-06-20
345,HSBC commits to Brexit Britain with world’s biggest co-working space in London,2019-06-20
346,Maharashtra: World’s smallest woman takes part in yoga day celebration in Nagpur,2019-06-20
347,5 Best Grocery Delivery Services with Free Trials & Low Fees ...,2019-06-20
348,KCPD locate missing 15-year-old girl,2019-06-20
349,CMC Markets Adds 3 Bespoke Crypto Indices to Offering,2019-06-25
350,'The Bachelorette': Jed Wyatt's Ex Makes a Big Reveal About His Signature Guitar (Exclusive),2019-06-25
351,Rosie O'Donnell Defends Meghan McCain But Wishes She 'Wouldn't Be So Mean to Joy Behar',2019-06-25
352,What New U.S. Sanctions Mean for Iran,2019-06-25
353,Bella Thorne Emotional After Ex Tana Mongeau Announces Engagement to Jake Paul,2019-06-25
354,"How to Get Past the ""Hard Right Edge"" And Find Breakthrough Stocks to Buy",2019-06-25
355,"Until Tariffs Are Resolved, Roku Stock Could Face Technical Difficulties",2019-06-25
356,Filipino Politician Calls for FX Regulations,2019-06-25
357,"Aldi to soon own 1,200 UK stores as it opens 21 more in bid to cover every town in country",2019-06-25
358,Report: Brands not understanding shopper needs,2019-06-25
359,Taylor Swift Accuses Scooter Braun of 'Bullying' Her,2019-06-30
360,"Bitcoin, Facebook and the End of 20th Century Money - CoinDesk",2019-06-30
361,Watch: Woman forest ranger attacked by TRS workers,2019-06-30
362,Phase Technologies celebrates 20 years of quietly shaping an industry,2019-06-30
363,Blockchain Capital's Spencer Bogart Explains This Week's Wild Bitcoin Price Swings,2019-06-30
364,World bank approves USD 722 million loan for Pakistan,2019-06-30
365,ASIT Biotech Continues its Transformation From Research to Late Stage Clinical Development,2019-06-30
366,Dogecoin Price Surges 37% Following Binance Listing Announcement - CoinDesk,2019-07-05
367,Dogecoin Finally Listed on Binance — DOGE Price Up 30%,2019-07-05
368,Is Elon Musk and Vitalik Buterin The Reason For Dogecoin's Listing At Binance? DOGE Soars - Ethereum,2019-07-05
369,Maker of Jaguar and Land Rover Plans to Build New Range of Electric Cars in the U.K.,2019-07-05
370,Followme Brings the Next-Gen AI Social Trading Network,2019-07-05
371,3 Best Low-Cost IOTA Exchanges for June 2021 • Benzinga,2019-07-05
372,Blue Bell Ice Cream Licker Faces 20 Years in Prison,2019-07-05
373,"Budget day: Sensex cracks 395 pts; metal, power stocks sink",2019-07-05
374,Tron’s Justin Sun Breaks His Silence Over Ponzi Schemes,2019-07-05
375,Christine Lagarde appointment risks making the ECB weaker,2019-07-05
376,Vislink Technologies News: VISL Stock Soars on U.S. Army Deal,2019-07-10
377,Kim Darroch Quits as U.K. Ambassador After Infuriating Trump,2019-07-10
378,Meghan Markle and Kate Middleton Have Play Date With Prince Louis and Archie at Polo Match,2019-07-10
379,DX.Exchange Launches Leveraged Crypto Tokens on Ethereum,2019-07-10
380,Blockchain Firm Diginex May Soon List on Nasdaq in the US: Report - CoinDesk,2019-07-10
381,DOGE price analysis 10 July 2019; Dogecoin's growth is ...,2019-07-10
382,Bitcoin network value at all-time high based on average price paid per BTC,2019-07-10
383,"Exclusive: Tradesocio Opens Dubai Office, Plans One in London",2019-07-10
384,Founder Of CryptoControl On Mission To Improve Trading In 'Maturing' Space,2019-07-10
385,Ford's Revving Its Engine This Summer Despite China,2019-07-10
386,Kim Cattrall Says She Will 'Never' Reprise Her 'Sex and the City' Role as Samantha Jones,2019-07-15
387,'Bachelorette' Hannah Brown Slays Luke Parker With Windmill Reveal: Everything She Said to Him,2019-07-15
388,"Congresswomen Fire Back at Trump, Say ‘Our Squad Is Big. We Will Not Be Silenced’",2019-07-15
389,Revolut to Appoint Martin Gilbert as First-Ever Chairman,2019-07-15
390,ETX Capital waves goodbye to Ollie Rosewell as he joins ...,2019-07-15
391,Mumbai: Gelatin sticks provider held,2019-07-15
392,Infographic: Why email is your weakest security link,2019-07-15
393,Lowest Price Ever: Razer DeathAdder Elite Is $35 for Prime Day,2019-07-15
394,Georgia Exempts VAT from Crypto-Fiat Transactions,2019-07-15
395,Jason Kander joins group behind KC’s tiny house village for veterans,2019-07-15
396,Cameron Boyce's Mom Libby Shares Heartbreaking Post Weeks After His Death,2019-07-20
397,'Riverdale' Romance Rundown: The Cast Gives An Update on Where Their Relationships Stand (Exclusive),2019-07-20
398,Dogecoin (DOGE/USD): DOGE Price Under Selling Pressure ...,2019-07-20
399,"'Star Trek: Picard' Brings Back Jeri Ryan, Brent Spiner, Jonathan Frakes and More",2019-07-20
400,Should Disney Be Prepared for Live-Action Fatigue?,2019-07-20
401,Dogecoin Mining Rewards Could Outweigh Litecoin's ...,2019-07-20
402,"MS Dhoni to serve Territorial Army, unavailable for Indian team’s tour of West Indies",2019-07-20
403,Congress leader Sheila Dikshit passes away at the age of 81,2019-07-20
404,"Anandiben Patel made UP governor, Lal ji Tandon to replace her in Madhya Pradesh",2019-07-20
405,Sound Advice: Getting just the right picture setting,2019-07-20
406,Becky G Slams Trolls Who Accused Her of Shading Selena ...,2019-07-25
407,Constance Wu Addresses Report Claiming She's a 'Diva' and Insisted on 'Hustlers' Top Billing,2019-07-25
408,"Tansa lake, a key water source for Mumbai, starts overflowing",2019-07-25
409,"IG CEO Buys £150,000 in Company Shares",2019-07-25
410,BitTorrent founder accuses Justin Sun of failed payment in TRON Foundation’s $140 million acquisition,2019-07-25
411,Norwegian Air to Accept Bitcoin Through Exchange Set up By Founder - CoinDesk,2019-07-25
412,Grant Thornton audits more than $10 billion in cryptoassets in ...,2019-07-25
413,"Bitcoin’s fading dream, a reasonable case for why BTC could fail",2019-07-25
414,Brave Browser users will soon be able to withdraw their Basic Attention Tokens,2019-07-25
415,How US Investors Are Buying Bitfinex's Blocked LEO Cryptocurrency - CoinDesk,2019-07-25
416,'Zoey 101' Cast Reunites Without Jamie Lynn Spears: 'I'm Lame and Fell Asleep',2019-07-30
417,Demi Lovato Makes Surprise Appearance at 'The Bachelorette' Season Finale,2019-07-30
418,Seth Moulton: Mueller Showed Us Why House Leadership Is Failing on Impeachment,2019-07-30
419,Seagate Entering Pilot Stage For Blockchain Supply Chain Project,2019-07-30
420,Educational Non-Profit Seeks $2 Million for Blockchain Literacy Programs in Pakistan and the Bahamas,2019-07-30
421,"ZTE Nubia Z20: flexi-display tech, 8K video recording",2019-07-30
422,WATCH: Metal Pay CEO Says He Isn't a Bitcoin Maximalist - CoinDesk,2019-07-30
423,Massive Bitcoin whale moves more than $1.3 billion worth of BTC,2019-07-30
424,Alternative Reality: China and Russia Might Be Libra’s Refuge,2019-07-30
425,PS4 breaks 100 million shipments ahead of PS5 release,2019-07-30
426,"Kennedy Family Finalizes Funeral Arrangements for RFK's Granddaughter, Saoirse Kennedy Hill",2019-08-04
427,Litecoin Halving: All You Need to Know Before the Day,2019-08-04
428,Goldman-Backed Apple Card Restricts Cryptocurrency ...,2019-08-04
429,Blow To Bitcoin As iPhone-Maker Apple Reveals Sudden Swerve,2019-08-04
430,Fluor Drops Sharply as Engineering Company Posts Second-Quarter Loss,2019-08-04
431,"PM Modi replies to Israel in Hebrew on Friendship Day, says ‘our relation is eternal’",2019-08-04
432,Low-lying areas in Pune on alert after dam water release,2019-08-04
433,"Here’s The Case For A $100,000 Bitcoin Price By The End Of 2021",2019-08-04
434,Bitcoin’s Computing Power Sets Record as Over 100K New Miners Go Online - CoinDesk,2019-08-04
435,ISRO releases pictures of Earth captured by Chandrayaan 2,2019-08-04
436,Chace Crawford's New Movie Is Like Grown-Up 'Gossip Girl': Watch the Trailer for 'Nighthawks' (Exclusive),2019-08-09
437,Brody Jenner Comments on Ex Kaitlynn Carter's 'Hot Girl Summer' With Miley Cyrus,2019-08-09
438,Start Comparing CVS Stock to UnitedHealth,2019-08-09
439,Coinbase Lists Tezos On Exchange,2019-08-09
440,ACY Securities Hires Russell Sandiford as Chief Market Analyst,2019-08-09
441,"Flat Subscription Rate, Custom Algorithms And Mobile Plans: Meet iFlip",2019-08-09
442,"Kevin O’Leary spends an insane amount of money on food, but here’s why",2019-08-09
443,108MP camera phone will take 12032 x 9024 resolution photos,2019-08-09
444,"Call of Duty is still an annual franchise, Activision says",2019-08-09
445,"After Samjhauta, Pakistan to suspend Thar express amid escalated tension",2019-08-09
446,Mohamed El-Erian: Fed being 'held hostage' by markets,2019-08-14
447,Brandi Cyrus Says She's 'Here' for Sister Miley Following Her Split From Liam Hemsworth,2019-08-14
448,Terra Signs Music Streaming Platform to Crypto Payments Alliance - CoinDesk,2019-08-14
449,Bitcoin's Price Looks Set for a Drop to $10K - CoinDesk,2019-08-14
450,"Coinbase May Have Split up With Barclays, but Now Its Got ClearBank",2019-08-14
451,"Trading Bandwidth For Crypto: NOIA Brings New Tech, Cisco Partnership To Programmable Internet Space",2019-08-14
452,19 ITBP officials to be conferred with medals on 73rd I-Day,2019-08-14
453,This is how much a pint costs in each of Scotland’s major towns and cities,2019-08-14
454,"SEC Charges Reggie Middleton With Fraud, Alleges ICO Manipulation",2019-08-14
455,"Barren Springs man sentenced on drug, grand larceny charges",2019-08-14
456,Kate Upton Shades Victoria’s Secret Fashion Show: 'It's a Snoozefest',2019-08-19
457,Katie Holmes Steps Out in NYC in First Sighting Since Jamie Foxx Split News,2019-08-19
458,"Chad Johnson Goes on Epic Bachelor Nation Twitter Rant, Calls Out Tyler Cameron and More",2019-08-19
459,How JoJo Fletcher & Jordan Rodgers Turned 'Bachelorette' Fame Into a Business -- and a New Show (Exclusive),2019-08-19
460,One Thing Could Boost Kohl’s Stock When It Reports Q2 Earnings,2019-08-19
461,Voyager Digital Lists Three New Coins to Growing Platform,2019-08-19
462,'Youngest Bitcoin Millionaire' Willing to Stake it All on Metal Pay - CoinDesk,2019-08-19
463,Extreme rhetoric in region not conducive to peace: PM Modi tells Donald Trump over phone,2019-08-19
464,Rakuten's Crypto Exchange Has Launched for Trading in 3 Cryptos - CoinDesk,2019-08-19
465,Silvergate Bank Eyes Crypto-Backed Loans for Institutions - CoinDesk,2019-08-19
466,Awkwafina Dances Around Rumors She's Joining 'Little Mermaid': 'I Would Be More Than Honored' (Exclusive),2019-08-24
467,"Police shoot, kill Utah man arrested for DUI",2019-08-24
468,UAE woman seeks divorce from husband. She felt choked by his extreme love and affection,2019-08-24
469,Bitcoin History Part 16: The First Mt. Gox Hack – Featured ...,2019-08-24
470,‘Black Panther 2’ release date announced. Here’s why it matters,2019-08-24
471,Send Token Payouts With Ease Using Bitcoin.com's SLP ...,2019-08-24
472,ESPN’s Lee Corso predicts Utah Utes will reach the national championship this year and face Alabama,2019-08-24
473,Hilary Duff to return in ‘Lizzie McGuire’ series on Disney+,2019-08-24
474,Two Arrested In Dorchester For Shooting At Each Other In Front Of Police,2019-08-24
475,"Arun Jaitley’s mortal remains to be kept at BJP HQ, last rites on Sunday afternoon",2019-08-24
476,Elon Musk Crosses Swords With Jack Ma Over AI Controlling Humans,2019-08-29
477,Liquid.com Integrates Quick Exchange into Mobile Trading App,2019-08-29
478,Nick Jonas on Mariah Carey Jokingly Saying She's 'Starting a New Band' With Him & Priyanka Chopra (Exclusive),2019-08-29
479,Pound US dollar exchange rate: GBP/USD steadies as US growth slows in second-quarter,2019-08-29
480,"Ethereum deemed halal by Muslim scholars, may stimulate ETH demand",2019-08-29
481,ETC/USD Breaks Week-Long Winning Streak,2019-08-29
482,SBI Holdings Subsidiary Will Pay a Shareholder Dividend in XRP,2019-08-29
483,"Hain Celestial Shares See Robust Rise Despite Earnings, Revenue Miss",2019-08-29
484,Pound Euro exchange rate: GBP/EUR flat as French economy grows faster than expected,2019-08-29
485,"Dairy Queen adds new Harvest Berry, Heath Caramel Blizzards",2019-08-29
486,Kevin Hart 'Recovering and Feeling OK' After Undergoing Surgery Following Car Accident,2019-09-03
487,"New Insta360 GO camera wearable, portable, and AI-powered",2019-09-03
488,David Beckham Hilariously Recalls Son Brooklyn Teasing Him for His Short Shorts in Old 'GQ' Spread (Exclusive),2019-09-03
489,'Dog's Most Wanted': Beth Chapman Doesn't Let Cancer Hold Her Back During Chase in Exclusive Sneak Peek,2019-09-03
490,"Now More Than Ever, Microsoft Stock Is a Buy",2019-09-03
491,Elon Musk says SpaceX has 'Area 59' with tech 8x better than Area 51,2019-09-03
492,Andreessen Horowitz lobbying financial watchdogs to loosen crypto regulations,2019-09-03
493,Don't Buy Hexo Stock as It Continues to Drop,2019-09-03
494,A Lesson in Leadership From the U.S. Open: raceAhead,2019-09-03
495,Discover Card leads JD Power customer satisfaction survey,2019-09-03
496,Paris Hilton Is 'So Proud' of Her Aunt Kyle Richards for First Fashion Show at NYFW (Exclusive),2019-09-08
497,See Robert Pattinson's Reaction to His 'Batman' Nicknames (Exclusive),2019-09-08
498,Will banks inevitably control the cryptocurrency market?,2019-09-08
499,Utah sees ‘sunshine on a cloudy day’,2019-09-08
500,10 Most Expensive Mistakes Hollywood Has Ever Made | TheRichest,2019-09-08
501,Tamilisai Soundararajan is new Telangana Governor,2019-09-08
502,10 Most Expensive Beers in The World | TheRichest,2019-09-08
503,Lori Loughlin’s latest update doesn’t make sense. Here’s why,2019-09-08
504,2 large fires burning in central Utah,2019-09-08
505,Man Arrested After Allegedly Kidnapping And Raping A Woman In Vallejo,2019-09-08
506,'BiP': Derek Peth Sets the Record Straight on JPJ's Claims He Hooked Up With a Podcast Fan (Exclusive),2019-09-13
507,"Disney CEO Bob Iger, Who Took Over Steve Jobs’ Seat, Resigns From Apple’s Board",2019-09-13
508,Santander issues $20 million bond on Ethereum blockchain,2019-09-13
509,FXCM Charges Lower Spread on BTC/USD Trades in August,2019-09-13
510,Maggie Gyllenhaal on The Deuce finale: Impossible to expect what’s coming,2019-09-13
511,Police investigate body found on I-15 in Orem after ‘possible suicide’,2019-09-13
512,Chiefs fan who buried Kingdom flag under Raiders new stadium speaks out,2019-09-13
513,Cisco Stock Isn't a Growth Stock Anymore -- And That's OK,2019-09-13
514,French Gov Official Warns Facebook: Libra Is Not Welcome Here,2019-09-13
515,7 Hot Penny Stocks to Consider Now,2019-09-13
516,Taylor Swift Says Kanye West Is 'Two-Faced' and Dishes on 'Context' of That Infamous Phone Call,2019-09-18
517,"'America's Got Talent' Crowns a New Champion In Surprising, Emotional Season 14 Finale -- See Who Won!",2019-09-18
518,"Binance returns to US after four-month absence, but 13 states are banned from exchange",2019-09-18
519,US Navy confirms multiple UFO videos are REAL,2019-09-18
520,Anthem is winding down into maintenance mode,2019-09-18
521,"Vinesh Phogat makes it to Olympics, to fight for bronze against Sarah Hildebrandt",2019-09-18
522,JD.com Stock's Problems Go Beyond the U.S.-China Trade War,2019-09-18
523,American Battery Metals hires ex-Tesla manager Ryan Melsert to head battery metal extraction and recycling divisions,2019-09-18
524,"BT MPW: Courage is in telling the truth, says Myleeta Aga Williams of BBC Worldwide",2019-09-18
525,2020 Big Slick dates announced,2019-09-18
526,New 'Frozen 2' Trailer Teases More Magic and Sterling K. Brown,2019-09-23
527,Malcolm Ford Leaves CMC for Assure Hedge,2019-09-23
528,"Facebook Is Buying CTRL-Labs, Neuron-Reading Startup to Help Control Its AR Glasses",2019-09-23
529,'Dancing With the Stars': A Complete Guide to the New Ballroom Rules,2019-09-23
530,Review: 1MDB book is a whale of a tale,2019-09-23
531,"Crypto is an Intangible Asset, Global Accounting Standards Body Argues - CoinDesk",2019-09-23
532,It's the International Day of Sign Languages! Here are some simple signs you should know,2019-09-23
533,BNP Paribas takes on Deutsche Bank's prime brokerage clients,2019-09-23
534,From reaching Mars to imaging black holes: IIT Gandhinagar’s annual tech summit is ‘Transcending Boundaries’,2019-09-23
535,Bitcoin Market Falls Sharply As Litecoin Suddenly Crashes,2019-09-23
536,Dogecoin listed on CoinTiger Exchange,2019-09-28
537,Justin Bieber Shares Super Cute Throwback Pic With Hailey Ahead of Second Wedding,2019-09-28
538,Utah Highway Patrol vehicle struck on I-15,2019-09-28
539,"Congress Questions The SEC On Libra, Cryptocurrency And “The Whole Blockchain Phenomenon”",2019-09-28
540,Tow truck driver charged with 31 counts of forgery,2019-09-28
541,How Leverage Can Help With Bitcoin’s Price Discovery,2019-09-28
542,What are the cryptocurrency habits in Colombia?,2019-09-28
543,Mind-mining with start-ups: How MobiKwik turned around within a year,2019-09-28
544,Hidden Lightning Network Bug Allowed Spending of 'Fake ...,2019-09-28
545,"Maggie Gyllenhaal Says Robert Pattinson Will Be ""Great"" As Batman",2019-09-28
546,How VR creates an immersive experience for readers,2019-10-03
547,Melinda Gates’s Outrage Prompts a $1 Billion Pledge: Broadsheet,2019-10-03
548,'The King's Man' Cast Promises WWI Prequel Is 'Serious But ...,2019-10-03
549,OmegaFX Limited Singled Out by Austria’s FMA,2019-10-03
550,"Alibaba Stock Is Dirt Cheap, but Optical Risks May Keep It That Way",2019-10-03
551,Company behind struggling coin ndau claims to raise another $5 million,2019-10-03
552,Sudhanshu Trivedi is BJP candidate for Rajya Sabha from Uttar Pradesh,2019-10-03
553,Central Banks Suddenly Woke Up When Facebook’s Libra Became A Reality,2019-10-03
554,Tata Nexon EV India launch confirmed: Checkout price and specifications,2019-10-03
555,Hy-Vee provides list of locations affected by payment card data incident,2019-10-03
556,Chris Harrison Says 'Bachelor' Star Peter Weber Suffered a Freak Accident But is '100% OK' (Exclusive),2019-10-08
557,Cody Simpson Helps Nurse Miley Cyrus Back to Health After Her Tonsillitis Diagnosis,2019-10-08
558,"3 Big Stock Charts for Tuesday: Schlumberger, Bank of America and Fidelity National Information Services",2019-10-08
559,‘She-Ra’ Season 4: The Cast Teases What's in Store (Exclusive),2019-10-08
560,Dogecoin Dipped by 4% in the Last 30 Days,2019-10-08
561,"Apex Legends Halloween event: Nightmare map, ZOMBIES, and more",2019-10-08
562,"Crypto Market’s Correlation to Bitcoin Price Slipping, With BSV, XRP and XLM Most Independent: CoinMetrics",2019-10-08
563,How to buy a house even without down payment help from ...,2019-10-08
564,"Streaming Wars, Social Media And 5G: Comms Sector Earnings Preview",2019-10-08
565,Massive new study links pollution to assaults and domestic violence,2019-10-08
566,"Call of Duty pro tournaments will be played on PS4, not PC",2019-10-13
567,Dutch National Bank Says Gold Can Re-Start Economy in ...,2019-10-13
568,Is This The Real Reason Behind Bitcoin’s Latest Sell-Off?,2019-10-13
569,Coinbase Receives E-Money License From the Central Bank ...,2019-10-13
570,Breast Cancer Vaccine To Be Made Available In Less Than A Decade,2019-10-13
571,What Is Bruno Mars' Net Worth?,2019-10-13
572,How Much Do Wedding Invitations Cost?,2019-10-13
573,"Bucs Shaq Barrett, Mike Edwards will give it a go vs. Panthers",2019-10-13
574,Robert Downey Jr. shares first poster of ‘Dolittle’ ahead of trailer release,2019-10-13
575,10 Of The Most Expensive Hotel Suites In Tokyo | TheRichest,2019-10-13
576,'Lost' Creator Damon Lindelof Addresses Reboot Rumors and Why 'Watchmen' Is a Must-Watch! (Exclusive),2019-10-18
577,Binance Burns $36.7M in BNB After 2nd-Most Profitable Quarter Ever,2019-10-18
578,Bears Continue to Hold the Reins in the Case of Dogecoin,2019-10-18
579,Kansas City Southern Earnings: KSU Stock Surges 6% on Strong Q3,2019-10-18
580,Gildan Activewear Earnings Preview: GIL Stock Plunges 25% on Guidance Update,2019-10-18
581,Serious Dark Web Warning Issued After Tor Browser Users Have Bitcoin Stolen,2019-10-18
582,American Express Beats Third-Quarter Estimates as Card Fees Set Record,2019-10-18
583,Binance Hikes Leverage to 125x for Launch of Bitcoin-Tether Futures,2019-10-18
584,Bridgewater's Ray Dalio says wealth gap is as bad as the 1930s,2019-10-18
585,Coca-Cola Sees Stronger 2019 Operating Income Growth as Q3 Sales Top Forecasts,2019-10-18
586,Is Dogecoin making a comeback?,2019-10-23
587,Pete Davidson Spotted With Kaia Gerber After Reported Margaret Qualley Split,2019-10-23
588,Kelly Ripa Says Son Michael Is Experiencing 'Extreme Poverty' for the First Time,2019-10-23
589,Selena Gomez Steps Out Smiling in Sexy Power Suit Upon Release of 'Lose You to Love Me' Song,2019-10-23
590,Microsoft Beats on Earnings and Revenues - Live Blog,2019-10-23
591,Exclusive: MultiBank Becomes Official Partner of BMW M Motorsport,2019-10-23
592,Celsius Now Offers 12 Percent Annual Interest on Tether Deposits,2019-10-23
593,Cardano Ties with COTI to Build an ADA Payment Gateway,2019-10-23
594,Gartner IT Symposium/Xpo: Global IT spending to rebound and grow 3.7% in 2020,2019-10-23
595,More Banks Are Teaming Up To Test Blockchain Solutions,2019-10-23
596,Miley Cyrus Choreographs Dance in Her Bra With Cody Simpson for TikTok,2019-10-28
597,3D Without Glasses! Patented Tech To Disrupt Home Viewing ...,2019-10-28
598,"Almost 70 percent of Ethereum addresses are at a loss, but HOLDing is at an all-time high",2019-10-28
599,NASA shares a photo of the sun. It looks like a giant jack-o’-lantern.,2019-10-28
600,"PM Modi leaves for Saudi Arabia, two nations to sign a dozen agreements",2019-10-28
601,Why Blockchain Is The Best Identity Theft Insurance Out There,2019-10-28
602,‘The Mandalorian’ is dropping a new trailer tonight,2019-10-28
603,Aphria Stock Is a Standout Long-Term Winner in the Cannabis Market,2019-10-28
604,How to Play EA Stock for Earnings,2019-10-28
605,"Verisign set to increase .com yearly registration fees, pending ICANN approval",2019-10-28
606,Binance Coin (BNB) utility is growing exponentially and its price may follow,2019-11-02
607,Amazon Starts Small Business Academy,2019-11-02
608,Impeachment raised as issue in GOP primary for Kansas seat,2019-11-02
609,It's Cookie Monster's Birthday! Here are the most powerful lessons he's taught us,2019-11-02
610,Was surrounded by match-fixers during my playing days: Shoaib Akhtar,2019-11-02
611,Surface Pro 7 vs. iPad Pro (12.9 Inch): Which Is Right for You?,2019-11-02
612,‘My phone being tapped’: alleges WB CM Mamata Banerjee,2019-11-02
613,How to Live Stream Canelo vs. Kovalev Online,2019-11-02
614,Andrew Yang's 'Freedom Dividend' Is Not Only Unnecessary ...,2019-11-02
615,Want To Invest In Umicore SA (EBR:UMI)? Here's How It Performed Lately,2019-11-02
616,Kaia Gerber Wears 'P' Initial Necklace Amid Pete Davidson Romance Rumors,2019-11-07
617,Nielsen to separate into two publicly traded companies,2019-11-07
618,Why You Need to Consider Buying This Beaten-Down Travel ...,2019-11-07
