,title,datetime
619,Jennifer Aniston Hilariously Responds to Courteney Cox and Matthew Perry's Lunch Date Without Her (Exclusive),2019-11-07
620,Dr Disrespect: anyone over 13 playing Fortnite 'has a problem',2019-11-07
621,Coinbase Will Now Reward Users for Holding This Cryptocurrency - CoinDesk,2019-11-07
622,66% Annual Returns for Decades,2019-11-07
623,T.I.'s Daughter Deyjah Harris Seemingly Responds to His Comments About Her Virginity By 'Liking' These Tweets,2019-11-07
624,Ripple CEO discusses plans for 2020; where is XRP heading next?,2019-11-07
625,"Crypto Market Recap: Bitcoin, Ethereum, Ripple, Bitcoin Cash, Tether",2019-11-07
626,'Vanderpump Rules' Star Kristen Doute Says She's at a 'Low' With Friendships on the Show (Exclusive),2019-11-12
627,Dell Tech Summit: Want to help the environment? Start with your company culture,2019-11-12
628,See Chrissy Teigen's Epic Reaction to Husband John Legend Being Named 2019 Sexiest Man Alive,2019-11-12
629,‘I Just Want My Baby Back’ Sacramento Woman Searching For Missing Squirrel,2019-11-12
630,'Additional Flexibility': NinjaTrader Adds Options Trading,2019-11-12
631,"Tesla Will Officially Build Its Next Gigafactory In Berlin, Germany",2019-11-12
632,Justin Bieber Reveals A First Look at New Movie 'Cupid',2019-11-12
633,Ethereum developer activity is seeing “parabolic” growth says analyst; will price follow?,2019-11-12
634,"Kansas City woman sentenced for embezzling $547,000 from foundation",2019-11-12
635,Evercoin Launches Bitcoin and Cryptocurrency Hardware ...,2019-11-12
636,Mitsubishi Electric Power Products Prepares To Close ...,2019-11-17
637,I drove a three-wheeled electric vehicle in NYC and lived to tell about it,2019-11-17
638,People misuse steroids which is bad for their body: Salman Khan at fitness event in Mumbai,2019-11-17
639,Market Update: Crypto Prices Improve After 3-Week ...,2019-11-17
640,Three XRP subreddits you should follow,2019-11-17
641,‘Star Wars: The Rise of Skywalker’: What will happen to Leia?,2019-11-17
642,10 Insanely Expensive Motor Homes That Cost More Than A House,2019-11-17
643,Nike pulling its shoes off Amazon is another blow to online behemoths,2019-11-17
644,Canadian Company Commissions 3 Bitcoin Mining Units to ...,2019-11-17
645,Ant expert discovers new Utah species in backyard,2019-11-17
646,Justin Hartley Files for Divorce From Wife Chrishell Stause After 2 Years of Marriage,2019-11-22
647,Right Now Twitter Stock Looks Completely Oversold,2019-11-22
648,DogeCoin Is Tiny Now but It Will Grow and Might Move towards 35 Satoshis,2019-11-22
649,Lawyer behind OneCoin ‘Cryptoqueen’ scam is found guilty,2019-11-22
650,FCA Continues Crackdown on Unregulated CFDs Brokers,2019-11-22
651,Catch up on the news with these 8 cartoons,2019-11-22
652,Conservancy / Solid Waste Management Service For Local Governments exempt from TDS: AAR [Read Order] | Taxscan,2019-11-22
653,SPG amendment bill to be tabled in Parliament next week,2019-11-22
654,"Ripple’s Price Looks to Crack Major Level, XRPUSD Could Slide to $0.1382",2019-11-22
655,Maharashtra: Shiv Sena corporator Kishori Pednekar is Mumbai’s new Mayor,2019-11-22
656,Kylie Jenner Reveals Her Real Hair in Post-Shower Video,2019-11-27
657,"Tesla Cybertruck hits 250,000 pre-orders",2019-11-27
658,Crypto community urges Jack Dorsey to memorialize Bitcoin pioneer Hal Finney’s Twitter account,2019-11-27
659,Red Dead Redemption 2 comes to Steam December 5,2019-11-27
660,Keep Calm and HODL On? 3 Reasons to Look Past Bitcoin's Price Rout - CoinDesk,2019-11-27
661,1 killed in crash on I-15 near Willard,2019-11-27
662,"Move Over Jack Dorsey And Elon Musk, There’s A New Bitcoin Believer In Silicon Valley",2019-11-27
663,Kansas Supreme Court rules sleeping judge not automatic reason for retrial,2019-11-27
664,Bitfinex and Tether Receive Another Class Action Lawsuit in ...,2019-11-27
665,Arvind Kejriwal Unlikely To Attend Swearing-In Of Uddhav Thackeray,2019-11-27
666,Political tension in Mauritania amid return of former leader,2019-12-02
667,Dmitri Galinov’s New FX Derivatives Exchange Goes Live,2019-12-02
668,Nomura CEO Koji Nagai to Step Down in April 2020,2019-12-02
669,Binance Now Offering Free and Instant Internal Transfers,2019-12-02
670,The 5 Biggest Trends In Cryptocurrency For 2020,2019-12-02
671,‘Sapna hai Sach Hai’ – third soundtrack from ‘Panipat’ out now,2019-12-02
672,Manish Pandey marries actress Ashrita Shetty in Mumbai,2019-12-02
673,Ollie's Bargain Outlet Slumps After Chairman and CEO Butler Dies at 61,2019-12-02
674,10 of the Best Stocks to Buy Right Now From the JUST 100 List,2019-12-02
675,"Instant Pot Duo 80 is now $65, so you have no excuse not to cook",2019-12-02
676,Camila Cabello Says Performing 'Señorita' Without Boyfriend Shawn Mendes Is 'Lonely' (Exclusive),2019-12-07
677,Inversion swamping the Salt Lake Valley is expected to clear out soon,2019-12-07
678,2019 hasn't been kind to digital card games,2019-12-07
679,Pati Patni Aur Woh mints Rs 9.10 crore on opening day,2019-12-07
680,Exercising key to increase oxygen in the brain: Study,2019-12-07
681,"Serious Bitcoin Warning Issued For Millions Of Facebook, Yahoo, And MSN Users",2019-12-07
682,SEC Approves Bitcoin Futures Fund – Regulation Bitcoin News,2019-12-07
683,"Dillard's to spend millions remodeling former Sears space at Richland Mall, plans May move",2019-12-07
684,"While Markets Move Sideways, Crypto Whale Sightings ...",2019-12-07
685,Boerse Stuttgart's Crypto Exchange Live for All Traders in ...,2019-12-07
686,Kate Middleton Recycles Princess Diana's Tiara as Queen Elizabeth Drips in Emeralds,2019-12-12
687,Selena Gomez Reveals the Advice She Gave Her Little Sister Before Her Red Carpet Debut,2019-12-12
688,Did ‘brother’ AB De Villiers inspire Virat Kohli’s ‘comical O’ celebration?,2019-12-12
689,Is Shopify Stock Going Back to All-Time Highs?,2019-12-12
690,Jack Black Calls Rumors He's Retiring After New 'Jumanji' Movie 'Fake News',2019-12-12
691,"Elon Musk on life being a video game: graphics are great, DLC is $$$$",2019-12-12
692,Is the Dividend of Altria Stock High Enough to Offset Its Controversies?,2019-12-12
693,"Trading Movies, What Can We Learn from Them?",2019-12-12
694,"Roku Stock Is Expensive, But Worth It",2019-12-12
695,Margin's Role In Cryptocurrency Trading,2019-12-12
696,Blake Shelton Shares How Gwen Stefani Has ‘Fallen in Love’ With Country Music Since They Met,2019-12-17
697,Meghan McCain and Whoopi Goldberg Talk Out Their Differences on 'The View': 'We Fight Like We're Family',2019-12-17
698,Seattle Tech Startup Offering Tax Services to the ...,2019-12-17
699,Boeing’s Overseas Airline Customers and Suppliers Sink on the Decision to Halt the 737 MAX,2019-12-17
700,"Bitcoin, Ethereum & Litecoin - American Wrap: 12/17/19",2019-12-17
701,SNOW WINDOWS: families bring winter wonderlands to life with designer stencils,2019-12-17
702,Can The Crypto Market Spur A Santa Claus Rally Following December Shivers?,2019-12-17
703,"DMRC reopens entry, exit gates of Seelampur metro station",2019-12-17
704,Mormon Church Reportedly Amassed $100 Billion Fund For ‘Second Coming Of Christ’,2019-12-17
705,Will 2020 Be The Year Of Enterprise Bitcoin?,2019-12-17
706,Katy Perry looks divine on Vogue India’s cover,2019-12-22
707,‘Ramen shoes’ become instant meme hit,2019-12-22
708,Benling India unveils Aura electric scooter,2019-12-22
709,Why Energy Retailers Could Benefit From Giving Power to the People,2019-12-22
710,Apple working on satellite project to support iOS devices,2019-12-22
711,Why Quantum Computing's Threat to Crypto May Be Further ...,2019-12-22
712,Christmas reminder: Success in life depends on human kindness,2019-12-22
713,The Cast Of Arrival's Net Worth | TheRichest,2019-12-22
714,Is Weight Watchers' Extended Partnership With Oprah Winfrey ...,2019-12-22
715,"Prashant Kishor suggests 2 ways to stop CAA, NRC implementation",2019-12-22
716,Pacific Association Preparing for 2020,2019-12-27
717,Why Snapchat Stock Could Be the Best Growth Pick for 2020,2019-12-27
718,Will the Next Decade Mark the Resurgence of GE?,2019-12-27
719,Netanyahu wins landslide victory in party primaries ahead of unprecedented third general election,2019-12-27
720,"Boeing Lawyer Michael Luttig, a Top Adviser on MAX Crisis, to Retire",2019-12-27
721,YouTube Calls Mass Deletion of Cryptocurrency Videos a Mistake,2019-12-27
722,"Anurag Basu’s ‘Ludo’ to release on January 24, 2020",2019-12-27
723,4 “Last-Minute” Tax Saving Strategies Crypto Holders Should Not Miss,2019-12-27
724,One Critical Metric to Watch for Etsy Stock in 2020,2019-12-27
725,5G Could Set Up Cisco Stock for More Gains,2019-12-27
726,Takasbank Launches Digital Gold Transfer System on Blockchain,2020-01-01
727,Will 2020 Be the Year of New Beginnings for DOGE Price?,2020-01-01
728,"BJP office to have India maps depicting new status of Jammu and Kashmir, Ladakh",2020-01-01
729,Wifi Sharing Platform Wicrypt Gets Government Grant in ...,2020-01-01
730,California man dies while skiing in Park City,2020-01-01
731,Alleged $8B BTC Tulip Trust Expires With Tales of Bonded ...,2020-01-01
732,Using a VPN May Get Israeli Crypto Traders in Trouble ...,2020-01-01
733,3 Best U.S. Marijuana Stocks of 2019: Are They Buys Now?,2020-01-01
734,Modi govt approves Chandrayaan-3; launch may happen next year: ISRO Chief,2020-01-01
735,"Ripple Price Analysis: New Decade, Old Resistance – XRP To Overcome $0.20 In January?",2020-01-01
736,One Of The Biggest Bets In Bitcoin Revealed To Be A ‘Ruse’,2020-01-06
737,"Tyler & Cameron Winklevoss – Net Worth, Cryptocurrency holdings, Bio (in 2020)",2020-01-06
738,Hackers Are Hijacking Popular Youtubers to Run Cryptocurrency Scams,2020-01-06
739,American Settles With Boeing for Massive Income Hit From the 737 Max Grounding,2020-01-06
740,Ricky Gervais Reveals What He Said in His Censored Joke at the 2020 Golden Globes,2020-01-06
741,Turkish regulatory group to propose new crypto rules and regulation,2020-01-06
742,Cryptocurrency Question On IRS Schedule 1: ‘Exchange’ Category,2020-01-06
743,IBM Blockchain App Promotes ‘Virtuous Cycle’ for Sustainable Coffee - CoinDesk,2020-01-06
744,"LG’s Rollable OLED TV is finally going on sale in 2020 — and it may cost $60,000",2020-01-06
745,McAfee Catches Heat After Welshing On Famous Bitcoin Bet ...,2020-01-06
746,Five YouTube cryptocurrency channels you should subscribe to,2020-01-11
747,"Will take action to reclaim PoK if ordered, says Army Chief Mukund Naravane",2020-01-11
748,New evidence suggests that XRP could be deemed a security,2020-01-11
749,Internet Man Of Mystery Virgil Griffith Indicted For Crypto Trip To North Korea,2020-01-11
750,Cryptojacking reduced by 78% thanks to Interpol and Trend Micro operation,2020-01-11
751,Court Gives Craig Wright More Time to Await the Mysterious ...,2020-01-11
752,JBL finally has its own line of gaming headsets,2020-01-11
753,"As Bitcoin Struggles, This Minor Cryptocurrency Is Up Almost 500% Over The Past 12 Months",2020-01-11
754,Getting to know: Ernie Hoch with Draper Aden Associates,2020-01-11
755,EU Countries Commence Crypto Regulations as Mandated by ...,2020-01-11
756,"Hey Alexa, order me a Coca-Cola Energy drink",2020-01-16
757,Ronnie Ortiz-Magro Granted Emergency Restraining Order Against Jen Harley,2020-01-16
758,Prince Harry and Meghan Markle's Son Archie Has Only Met His Royal Cousins 'a Handful of Times',2020-01-16
759,Gap sinks plan to spin off Old Navy,2020-01-16
760,"Hodlonaut’s case with Craig Wright gets dismissed, new battle to take place in Norway",2020-01-16
761,"Bitcoin, Ethereum & Litecoin - American Wrap: 1/16/2020",2020-01-16
762,NBA's Sacramento Kings Uses Blockchain To Ensure Fans Gets Authentic Auctioned Jerseys,2020-01-16
763,"Cyberpunk 2077 delayed to September 17, 2020",2020-01-16
764,The Top 5 Dow Jones Stocks to Buy for 2020,2020-01-16
765,Hurry! The best AirPods alternative just dropped to $109,2020-01-16
766,Jonas Brothers Hilariously Recreate ‘Camp Rock’ Movie Scene -- Watch!,2020-01-21
767,Teen charged with $50m cryptocurrency theft,2020-01-21
768,Israeli Counter-Terrorism Institute Reports Hamas Using Bitcoin As A Funding Source,2020-01-21
769,‘The next frontier in tech policy:’ IBM pushes business to help government develop A.I. anti-bias rules,2020-01-21
770,Bitfinex Addresses Institutional Demand With New Sub-Account Feature,2020-01-21
771,"Bitcoin, Ethereum & Litecoin - American Wrap: 1/21/2020",2020-01-21
772,"Court modifies Chandrashekhar Azad's bail conditions, allows him to visit Delhi",2020-01-21
773,Recap: Eight Events That Drove The Bitcoin Economy In 2019,2020-01-21
774,Sundance Film Festival: Why Holly from ‘The Office’ is about ‘to take over’,2020-01-21
775,8 Indian tourists die after falling unconscious at resort in central Nepal,2020-01-21
776,Shaquille O'Neal Mourns Kobe Bryant's Tragic Death: 'I'm Sick Right Now',2020-01-26
777,"Former Employees Sue Justin Sun and Tron Foundation, Alleging Workplace Hostilities - CoinDesk",2020-01-26
778,Dubai Launching Crypto Valley in Tax-Free Zone – No ...,2020-01-26
779,Everybody's Staking But Who's Using Proof of Stake ...,2020-01-26
780,"Tableaux showcase India’s diversity, progress at 71st Republic Day parade",2020-01-26
781,"Music stars mourn, pay tribute to Kobe Bryant at Grammys",2020-01-26
782,Mechanised infantry and marching columns on Rajpath during Republic Day Parade,2020-01-26
783,BYU football coach Kalani Sitake adds two more recruits as another college football signing day approaches,2020-01-26
784,Bitcoin Gold 51% Attacked - Network Loses $70000 in Double ...,2020-01-26
785,More than half of Utahns struggle to afford health care,2020-01-26
786,Demi Lovato Talks About the 'Really Beautiful' Moment She Came Out to Her Parents,2020-01-31
787,Taylor Swift Releases Uplifting Political Anthem 'Only the Young' From 'Miss Americana' Doc,2020-01-31
788,CN Rail workers ratify collective agreement that focuses on ...,2020-01-31
789,Microsoft Finds Cryptocurrency Mining Malware Hidden in Kobe Bryant Wallpaper,2020-01-31
790,Morgan Stanley Names Two New Heads for FX Options Desk,2020-01-31
791,5G: What it means for IoT (free PDF),2020-01-31
792,Google Stadia's biggest challenge with streaming and meeting gamers' expectations,2020-01-31
793,XRP Utility On The Increase As Digital Assets Market Approaches Maturity,2020-01-31
794,Tulsa Schools to enlarge partnership with Tulsa Tech to McLain High School in fall 2020,2020-01-31
795,"Oyo cuts staff strength by about 2,000, exits 200 cities as part of restructuring",2020-01-31
796,Meek Mill Confirms His Girlfriend Is Pregnant Amid Explosive Nicki Minaj Feud,2020-02-05
797,Jessica Simpson Recalls Dad Bringing a Male Model She Didn't Know to Her and Eric Johnson's Wedding,2020-02-05
798,Shaquille O'Neal's Son Shareef Gets Kobe and Gianna Bryant Tattoos,2020-02-05
799,Brie Bella Admits to Sister Nikki That She Wants a 'Better Marriage' in New 'Total Bellas' Trailer,2020-02-05
800,Current Uncertainty Allows Investors to Get Into JD Stock at a Discount,2020-02-05
801,ATFX Presents at International Forex Expo in Nigeria,2020-02-05
802,UK hospitals told to make secure pods for coronavirus patients – live,2020-02-05
803,Starbucks Loses Pershing Square as an Investor After Bill Ackman Sells Stake,2020-02-05
804,"Burqa-clad political analyst ‘caught’ at Shaheen Bagh, protesters claim she was filming them",2020-02-05
805,Bitcoin Volatility Reached A 7-Week High In January,2020-02-05
806,Amber Rose Gets Giant Forehead Tattoos in Honor of Her Sons: Pics,2020-02-10
807,Makor Group Adds Talal Dehbi to European Derivatives Team,2020-02-10
808,ZuluTrade Launches Copy-Trading Platform in the US,2020-02-10
809,"Ukraine Won't Regulate Crypto Mining, Government Ministry Says - CoinDesk",2020-02-10
810,ATFX Attends iGB Affiliate Conference London,2020-02-10
811,Senior woman police officer to lead probe into Gargi college incident,2020-02-10
812,USD Starts to Consolidate as Global Forex Market Takes Stock,2020-02-10
813,Popeyes Chicken Sandwich Leads to Earnings Beat for Restaurant Brands,2020-02-10
814,"Florida 1st grade teacher tried to buy an 'eight ball' of meth while at school, authorities say",2020-02-10
815,Checking ‘Yes’ For Schedule 1 Crypto Question May Not Be Enough,2020-02-10
0,Ben Affleck Says Going Blond for 'The Last Duel' Has Been 'Fun' (Exclusive),2020-03-01
1,Justin Bieber Only Had Eyes for Wife Hailey at His Big 26th Birthday Bash,2020-03-01
2,"New CEOs for Liquidnet, JPMorgan Chase & Co APAC: Executives on the Move",2020-03-01
3,Everything you need to know about Decentralized Finance ...,2020-03-01
4,Polymath Network Provides the Best Securities Token Platform,2020-03-01
5,18 of the Coolest Visualizations for Exploring the Bitcoin ...,2020-03-01
6,Is This The Real Reason Bitcoin Suddenly Collapsed?,2020-03-01
7,WHISTLEBLOWER: Australians scammed by fake Bitcoin traders,2020-03-02
8,25-year-old KCK man charged in connection to Saturday morning Westport shooting,2020-03-01
9,Opinion: How Blockchain Will Power The Electricity Grid of The Future,2020-03-01
10,Ben Affleck Says Going Blond for 'The Last Duel' Has Been 'Fun' (Exclusive),2020-03-01
11,Justin Bieber Only Had Eyes for Wife Hailey at His Big 26th Birthday Bash,2020-03-01
12,"New CEOs for Liquidnet, JPMorgan Chase & Co APAC: Executives on the Move",2020-03-01
13,18 of the Coolest Visualizations for Exploring the Bitcoin ...,2020-03-01
14,25-year-old KCK man charged in connection to Saturday morning Westport shooting,2020-03-01
15,Is This The Real Reason Bitcoin Suddenly Collapsed?,2020-03-01
16,WHISTLEBLOWER: Australians scammed by fake Bitcoin traders,2020-03-02
17,"As opioid deaths mount, countries experiment with vending machines, safe injection sites. But will they incra…",2020-03-01
18,Opinion: How Blockchain Will Power The Electricity Grid of The Future,2020-03-01
19,Polymath Network Provides the Best Securities Token Platform,2020-03-01
20,"Burgers, beers and Bitcoin: This crypto-friendly cafe in Spain has it all",2020-03-06
21,TP ICAP Names Mark Hemsley as Non-Executive Director,2020-03-06
22,Canaan Slapped with Class-Action Lawsuit for Dubious IPO Practices,2020-03-06
23,Dogecoin Price Analysis - DOGE Price Lagging Behind But Receives Support From Elon Musk?,2020-03-06
24,Coinbase CEO Brian Armstrong Just Revealed A Big Catalyst For Crypto’s Growth From 50 Million Users To 5 Billion,2020-03-06
25,FTSE 100 sheds 230 points in just three hours as coronavirus panic sweeps through,2020-03-06
26,"Numbers rise for women electricians, plumbers and builders, but still a way to go",2020-03-06
27,"CySEC Suspends Prior Capital CY, Awards TECFININE Latest CIF License",2020-03-06
28,Elon Musk Considers Dogecoin the Best Digital Asset,2020-03-06
29,Exchange Technology Developer AlphaPoint Raises $5.6M in Latest Funding Round - CoinDesk,2020-03-06
30,'Bachelorette' Clare Crawley's Contestants Revealed: Meet the Men Fighting For Her Heart,2020-03-11
31,FTSE 100 risers and fallers: Which shares have gone up today? Which has fallen?,2020-03-11
32,Harvey Weinstein Is Sentenced to 23 Years in Prison,2020-03-11
33,"Kraken Opens up FX Trading for Crypto Users, Except US Residents",2020-03-11
34,"FINMA Announces Executive Board Reshuffle, David Wyss to Leave",2020-03-11
35,Ethereum is down 27% in 4 days: here’s why it’s crashing harder than other cryptocurrencies,2020-03-11
36,Tokyo Police Arrest 2 Men for Buying Cryptocurrency Tied to ...,2020-03-11
37,Live streaming Elon Musk Ethereum scam emerges on YouTube,2020-03-11
38,Bitcoin Is Still Failing As A Flight To Safety Investment,2020-03-11
39,GBP/USD Forex Market Impacted by Rate Cut Decision,2020-03-11
40,"Roboy the robot is fully compliant, soft, and huggable",2020-03-16
41,US Watchdog Signs Off on LSE’s $27B Refinitiv Takeover,2020-03-16
42,Forrester Study: Reinventing Workflows,2020-03-16
43,Courteney Cox's TikTok Dance Routine Leaves Matthew Perry Confused,2020-03-16
44,Binance.US to Open Tezos (XTZ) Trading Amid Crypto Market Fallout,2020-03-16
45,Delta Exchange Launches Tether Gold Perpetual Contracts,2020-03-16
46,Coronavirus Downturn Prompts Bitcoiners To Take A Bet On Alternate Markets,2020-03-16
47,7 Dividend Stocks to Watch for Stable Income,2020-03-16
48,Herbert taps new executive director for Office of Energy Development,2020-03-16
49,Missouri Health and Senior Services says sixth positive COVID-19 case resulted overnight,2020-03-16
50,Lionel Richie Pens Heartbreaking Note to Late Kenny Rogers and Family: 'I Lost One of My Closest Friends',2020-03-21
51,BRIEF-Sleep Country Announces Temporary Closing Of All 'Sleep Country Canada' And 'Dormez-Vous' Retail Stores Due To COVID-19,2020-03-21
52,Crypto Archives,2020-03-21
53,"Tesla Gets Hammered - Registrations In Germany, Other ...",2020-03-21
54,1.2 Million Italians Can Now Buy Bitcoin From Their Bank ...,2020-03-21
55,Blow To Bitcoin As Russia Moves To Effectively Ban Crypto,2020-03-21
56,Coronavirus: Can the government force churches to close?,2020-03-21
57,"Coronavirus: Gehlot orders lockdown in Rajasthan till Mar 31, exempts essential services",2020-03-21
58,Time to get in shape! Here are six easy workout routines and exercises that you can follow while in quaran,2020-03-21
59,Bitcoin Having the Worst Downtrend: Is the good Time to Buy?,2020-03-21
60,"'Tiger King' Star John Finlay Shows Off His Brand New Teeth, Slams Netflix Series",2020-03-26
61,'One Day at a Time' Season 4 Sneak Peek: Watch Penelope and Schneider Face Off Over Money! (Exclusive),2020-03-26
62,Jimmy Fallon and Jimmy Kimmel's Kids Are Doing the Artwork for Their Late-Night Shows,2020-03-26
63,A Morgan Stanley Platform Faced Outage Due to Technical Issues,2020-03-26
64,"Men's Wearhouse parent furloughs all store workers, CEO takes pay cut",2020-03-26
65,Utah earthquake today: 3.3 magnitude shakes Salt Lake City,2020-03-26
66,"Bitcoin’s Hashrate Keeps Dropping, Now 45% Below Its All-Time High",2020-03-26
67,“Will Support Government”: Sonia Gandhi’s letter to PM Modi over lockdown,2020-03-26
68,"AMD: someone stole our graphics IP, demands $100 million in ransom",2020-03-26
69,Where Do Stocks Go From Here? History Provides a Playbook,2020-03-26
70,"Chris Cuomo, CNN Anchor, Tests Positive for Coronavirus",2020-03-31
71,Savannah Guthrie Reunites With Hoda Kotb to Host the 'Today' Show in the Studio,2020-03-31
72,'Tiger King' Star Howard Baskin Invites Kim Kardashian to Meet Carole to Get the Real Answers,2020-03-31
73,Plunging oil price presents an unexpected risk to the crypto market in April,2020-03-31
74,FBS Gives Away Signed FC Barcelona Jerseys for Playing Penalty Simulation,2020-03-31
75,Is Now the Time for a Digital Dollar?,2020-03-31
76,Did We Just Leave The Bear Market? If Only It Were That Simple,2020-03-31
77,Tesla to Demonstrate 30% Annual Delivery Increase This ...,2020-03-31
78,"Urban Outfitters Furloughs Staff, Suspends Buybacks and Cuts Executive Pay",2020-03-31
79,Coinbase Explains Why Price of Bitcoin Crashed Around 50% on March 12,2020-03-31
80,Tiffani Thiessen on Giving Her 'Saved by the Bell' Co-Stars a Practical Gift While Quarantining (Exclusive),2020-04-05
81,"Ganga water quality improves by 40-50 pc during lockdown, says expert",2020-04-05
82,New York City schools won't be using Zoom anymore because of security concerns,2020-04-05
83,"Coronavirus Is The ‘Largest Insolvency Event’ In History, Warns Former Goldman Sachs Fund Manager—Pivots Hard To Bitcoin",2020-04-05
84,Coronavirus cases jump in Kansas on Sunday,2020-04-05
85,Fact Check: Truth of corona conspiracy theory behind arrest of Harvard professor,2020-04-05
86,Volunteers of Radha Soami Satsang prepare food to distribute among the needy | See Pics,2020-04-05
87,"Emergent BioSolutions, Eyeing Two Plasma Therapies for Covid-19, Wins Fed's Help",2020-04-05
88,"John McAfee Praises Ethereum, Monero, And DAI While Branding Bitcoin As ‘Worthless’",2020-04-05
89,Everything You Need to Know About Zilliqa and Its Blockchain ...,2020-04-05
90,Sophie Turner Does Joe Jonas' Makeup in Quarantine and Impresses Herself,2020-04-10
91,"It only took Los Angeles 11 days to get 12,000 city workers telecommuting during the pandemic",2020-04-10
92,Kiely Williams and Raven-Symone Address Cheetah Girls and Adrienne Bailon Houghton Drama,2020-04-10
93,'Home Before Dark' Season 2: 'More Emotional' and a New Mystery (Exclusive),2020-04-10
94,Wells Fargo Hires Julia Bates as Technology Control Executive,2020-04-10
95,'Oh God!' Elon Musk shares terrifying picture depicting the world economy,2020-04-10
96,HTC Expands Crypto Lineup with Monero Mining Capabilities,2020-04-10
97,Fold launches a Visa debit card with Bitcoin rewards; here’s how it compared to other crypto reward programs,2020-04-10
98,These Ten Stablecoins Will Attract Attention In 2020,2020-04-10
99,Reddit May Use Ethereum for a New Token-Based Points System - CoinDesk,2020-04-10
100,Michael Bublé's Wife Luisana Lopilato Defends Him After Controversial Instagram Live,2020-04-15
101,Google secrets: Real reason company removed 'don't be evil' from code of conduct revealed,2020-04-15
102,OpenFin Hires Adrian Crockett as its Chief Product Officer,2020-04-15
103,Zaftr Teams up with CipherTrace to Enhance Crypto Compliance,2020-04-15
104,Elon Musk’s business venture that ‘could’ve been biggest company on Earth’ revealed,2020-04-15
105,Princess Anne Urges Younger Generation of Royals to 'Go Back to Basics',2020-04-15
106,Lindsay Lohan says her new album has a lot of memories from her life in California,2020-04-15
107,Google Pulls 49 Cryptocurrency Wallet Browser Extensions ...,2020-04-15
108,EUR/USD Forex Market Slips on Poor US Data,2020-04-15
109,"DLT's Great Leap Forward, Bitcoin Hoarders, a16z's New Fund - CoinDesk",2020-04-15
110,Brad Pitt Hilariously Reports on the Weather for John Krasinski’s ‘Some Good News’ Show,2020-04-20
